Timestamp,Date Posted,Title,Source Url,Translated Title,Meme Content Type,Country,Language,Meme Template Type,People,Original Filename,Google Drive Link
2022-12-31T13:34:19.000Z,12/31/2022,Властелин конца России,https://t.me/nexta_live/44021?comment=1736910,Lord of the end of Russia,"End of the Putin regime, War progress / outcome (general)",Russia,Russian,"Lord of the Rings (film), Poster",Putin,photo_2022-12-31_16-32-52,https://drive.google.com/open?id=18-5KfHEkvrqA8skRcHEw0iuB_e3LzFJm
2022-12-31T13:36:32.000Z,12/31/2022,[Symbolic representation of years 2020-2023],https://t.me/nexta_live/44021?comment=1736962,,"New Year, Ukraine (general), War progress / outcome (general), Z and/or V","Ukraine, Russia",n/a,Infographics,,photo_2022-12-31_16-34-36,https://drive.google.com/open?id=1qzPfZrMiYktoaKdOuTYJwN8H-lUoCEa6
2022-12-31T13:40:01.000Z,12/31/2022,2023: С контрнаступаючим! (c) хтось,https://t.me/nexta_live/44021?comment=1737037,2023: Happy counterattacking year! [word play] (c) somebody,"New Year, War progress / outcome (general)","Ukraine, Russia",Ukrainian,Text only,,photo_2022-12-31_16-37-06,https://drive.google.com/open?id=1NEAshst2EriqJvL-A3i7UCQ07-4nYlAh
2022-12-31T13:45:09.000Z,12/31/2022,"[Father Frost/Santa Claus is ringing a warning bell heading towards Russian Rostov-na-Donu, where some explosions have been reported]",https://t.me/nexta_live/44021?comment=1737047,,"New Year, War progress / outcome (general)",Russia,Russian,Holiday card,,photo_2022-12-31_16-40-25,https://drive.google.com/open?id=1IRRX0k1Pi4ffFeFvFWFNC7wax5Rt212t
2022-12-31T13:48:54.000Z,12/31/2022,"Новорічна програма: 23:59 – приліт по Москві, 00:00 приліт по всій території Росії",https://t.me/nexta_live/44021?comment=1737069,"New Year's program: 23:59 - airstrike on Moscow, 00:00 airstrikes across the entire territory of Russia","New Year, War progress / outcome (general)","Ukraine, Russia",Ukrainian,Screenshot,,photo_2022-12-31_16-45-30,https://drive.google.com/open?id=1kcbNYImYXC7QremNppiJuQ9n9rmh3OIJ
2022-12-31T13:53:06.000Z,12/31/2022,До Кобзона: нехай все погане піде геть у Новому році,https://www.facebook.com/photo.php?fbid=672520314349997&set=p.672520314349997&type=3,Leaving to see Kobzon: let all bad things go away in the New Year,"End of the Putin regime, Kobzon's concert, New Year",Russia,Ukrainian,Historical photo,"Putin, Kobzon, Lavrov",323439993_557949005914494_928096961830438907_n,https://drive.google.com/open?id=1WEcWQaZEUCdaDLOgYbSR6x12nR3ElWsU
2022-12-31T13:57:36.000Z,12/31/2022,[Symbolic representation of years 2020-2023],https://t.me/nexta_live/44021?comment=1736635,,"New Year, War progress / outcome (general), Z and/or V",Russia,n/a,Infographics,,photo_2022-12-31_16-56-12,https://drive.google.com/open?id=1r_JasFEdI2Vzh11PK7nvqnb0HexcrhwA
2022-12-31T14:00:41.000Z,12/31/2022,"Ivan, it's time to die",https://t.me/nexta_live/44002,,"Mobilization / military draft / recruitment in Russia, Obedient Russians",Russia,English,News photo,Putin,photo_2022-12-31_17-00-20,https://drive.google.com/open?id=1FVGN2-8sFKbWwK4ViOYkNNek26AjTGiE
2022-12-31T14:04:46.000Z,12/31/2022,С наступающим!,https://t.me/nexta_live/44022?comment=1737964,Happy New [stepping-on] year!,"New Year, War progress / outcome (general)","Ukraine, Russia",Russian,News photo,Putin,photo_2022-12-31_17-02-04,https://drive.google.com/open?id=1NkpqZk2rPXvsCon0DKfwepwW-MBatOe3
2022-12-31T14:13:28.000Z,12/31/2022,Шойгу поздравил армию РФ с отступающим,https://t.me/nexta_live/44022?comment=1738511,Shoigu wished the Russian army a happy New Year [i. e. congratulated it on its retreat],"New Year, Retreat of Russian forces",Russia,Russian,News photo,Shoigu,photo_2022-12-31_17-11-10,https://drive.google.com/open?id=1L2LyGj0dw_nhpD_IDgt1XhLwtOkhFYcx
2022-12-31T14:16:01.000Z,12/31/2022,"Надо, Вова! НАДО!",https://t.me/nexta_live/44022?comment=1738520,It is necessary Vova! NECESSARY!,"End of the Putin regime, Putin (general)",Russia,Russian,"News photo, Stock photo",Putin,photo_2022-12-31_17-13-59,https://drive.google.com/open?id=1cn6WP_fdmRALMRLAO--Fzu-DehjnvfCt
2022-12-31T14:18:14.000Z,12/31/2022,"Ми знайдемо кожну сволоту, яка бомбила нашу землю",https://t.me/nexta_live/44022?comment=1738527,We will find every bastard that bombed our land,"Civilian resistance in Ukraine, Ukraine (general)",Ukraine,Ukrainian,Animal photo,Borodyanka cat,photo_2022-12-31_17-16-07,https://drive.google.com/open?id=1YosMGReMhHOopEF0QYNvsLvbMdfolLTt
2022-12-31T14:23:39.000Z,12/31/2022,З наступаючим Новим роком! Нехай збудуться усі ваші бажання!,https://t.me/nexta_live/44022?comment=1738757,Happy New Year! May all your wishes come true!,"End of the Putin regime, New Year",Russia,Ukrainian,Holiday card,Putin,photo_2022-12-31_17-21-32,https://drive.google.com/open?id=1xTIgsXLY2ga7a62dMn_UlRZ7mP-Mfro9
2022-12-31T14:26:15.000Z,12/31/2022,Счастливого Нового года! Пусть сбудется главная ваша мечта!,https://t.me/nexta_live/44022?comment=1739777,Happy New Year! May your main dream come true!,"End of the Putin regime, New Year",Russia,Russian,Holiday card,Putin,photo_2022-12-31_17-24-40,https://drive.google.com/open?id=1czlNZiz1ExqIT2MfHOPx3V4eYhc2VZIG
2023-01-02T02:42:22.000Z,12/31/2022,Все буде Україна. Наступний рік - рік перемоги,https://t.me/ukrainearmedmemes/671,Everything will be Ukraine. Next year - a year of victory,"Ukraine (general), War progress / outcome (general)","Ukraine, Russia",Ukrainian,Map,,rik peremohy,https://drive.google.com/file/d/19Nl3cCCX_B4K0XhTQOPaXdbs5CSpqzhJ/view?usp=share_link
2023-01-02T03:02:06.000Z,12/31/2022,Коли збираєшся сам -- Коли тебе збирає мама,https://t.me/ukrainearmedmemes/665,When you equip yourself -- When mom equips you,"Ukrainian troops (general), Ukraine's heros (individual)",Ukraine,Ukrainian,News photo,Budanov (Kyrylo),mum equips you,https://drive.google.com/file/d/1bOvWFSqH9TqYmTehnJ0Cir5ak9Pln8ak/view?usp=share_link
2023-01-02T04:00:21.000Z,12/28/2022,Мы в серйоз еще не начіналі,https://t.me/ukrainearmedmemes/657,We haven't really started anything yet,We haven't really started anything yet,"Ukraine, Russia",Ukrainian,News photo,"Putin, Zaluzhnyǐ (Valeriǐ)",iesche nie nachinali,https://drive.google.com/open?id=1iy0J_UsligqSKPMaMuqA7jkawZZqCp7U
2023-01-02T05:42:34.000Z,12/27/2022,"22:00 - Сьогодні ляжу спати раніше -- 03:00 - Мало хто знає, але Бог на 8 день створив Крим і передав його Україні",https://t.me/ukrainearmedmemes/654,"22:00 - Today I will go to bed earlier -- 3:00 - Few people know that, but God created Crimea on the eighth day and handed it over to Ukraine",Crimea (explosions etc.),Ukraine,Ukrainian,Film (non-Soviet),,crimea creation,https://drive.google.com/open?id=1KYU6EUBeCjGb2aSLI-XmBu1y-yxYf_cp
2023-01-02T07:54:47.000Z,12/22/2022,АТБ Маркет,https://t.me/ukrainearmedmemes/648,ATB Market [Ukrainian grocery chain],"Lend-Lease and other military assistance to Ukraine, Zelensky visits USA (December 2022)","Ukraine, United States",Ukrainian,,"Zelensky, Biden",ATB Zelenskyi Biden,https://drive.google.com/file/d/1-mJmBDl8x91Uuj0jtScOfsXxuP4wNypY/view?usp=share_link
2023-01-03T01:41:59.000Z,1/2/2023,"""Комсомольская правда"": Украинские нацисты заставляют детей в школе выкладывать слайды для презентаций телами русских солдат. ""Презентація на тему: 'Вимоги до оформлення презентации'"". Учениця 10-Б класу Гімназії 317 Кулиш Дарина",https://t.me/ukrainearmedmemes/674,"""Komsomolskaya Pravda"": Ukrainian Nazis force children at school to post slides for presentations of the bodies of Russian soldiers. ""Presentation on the topic: 'Requirements for the design of the presentation.'"" Student of the 10-B class of the Gymnasium 317 Kulysh Darina.","Russian propaganda and state media, Russian troops (general)","Ukraine, Russia","Ukrainian, Russian","Screenshot, Corpses message",,Presentation,https://drive.google.com/file/d/14AFsF7TXSTZxzlQ72IY2yW81ZayFdZeS/view?usp=share_link
2023-01-03T02:14:50.000Z,12/22/2022,Здохло 100 тисяч росіян,https://t.me/ukrainearmedmemes/646,100 thousand Russians died,"Russian troops (general), War statistics","Ukraine, Russia",Ukrainian,Holiday card,Zaluzhnyǐ (Valeriǐ),postcard,https://drive.google.com/file/d/1gi9YnfWLp5GHWEAFqDgMglSF_4Ft7_BU/view?usp=share_link
2023-01-03T05:13:04.000Z,12/21/2022,Рево привіз?,https://t.me/ukrainearmedmemes/645,Have you brought the Revo?,"Zelensky visits USA (December 2022), Lend-Lease and other military assistance to Ukraine",Ukraine,Ukrainian,News photo,"Zelensky, Biden",teteriv,https://drive.google.com/file/d/1-JuA_VDfctDy9eNkj8BbWdz3MOpJJdt1/view?usp=share_link
2023-01-03T05:42:13.000Z,12/20/2022,Ідеального пункту незламності не існує. Тим часом ідеальний пункт незламності:,https://t.me/ukrainearmedmemes/644,"There is no perfect point of invincibility. Meanwhile, the ideal point of  invincibility:",Point of Invincibility (Ukrainian emergency shelter),Ukraine,Ukrainian,News photo,,point invincibility,https://drive.google.com/file/d/17gDygrvIGy-D_zuYaVja4smmx2_jvdxk/view?usp=share_link
2023-01-03T06:20:40.000Z,12/17/2022,"- Розкажи мені правду, я готова це почути. - Я набрехав тобі, що маю генератор. В мене також відключають світло.",https://t.me/ukrainearmedmemes/638,"- Tell me the truth, I'm ready to hear it. - I lied to you that I had a generator. They also turn off the lights at my house.",Power shortages in Ukraine,Ukraine,Ukrainian,Film (non-Soviet),,ups,https://drive.google.com/file/d/15tqfKh0Tl31LPmNRyPmDh2Ma-aWdgApb/view?usp=share_link
2023-01-04T00:50:14.000Z,12/6/2022,Російський адвент календар,https://t.me/ukrainearmedmemes/625,Russian Advent calender,Russian troops (general),Russia,Ukrainian,News photo,,Advent calender,https://drive.google.com/file/d/1OtVSUzMM0GtXIyZRBLBq4V7vYIMatNBp/view?usp=share_link
2023-01-04T01:49:27.000Z,12/7/2022,"Мої друзі їхали плацкартом до Івано-Франківська, і абсолютно випадково зробили цей кадр. Вразила Його простота. Навіть постіль не брав: спав на брудному матраці. Усім вагоном скинулися йому на чай, а він усміхнувся щиро, надпив, а цукор сховав у кишеню піджака. ""Дітей пригощу"", - каже.",https://t.me/ukrainearmedmemes/627,"My friends were riding on a train to Ivano-Frankivsk, and quite accidentally took this shot. His simplicity was striking. He didn't even take linens: he slept on a dirty mattress. The whole carriage chipped in to buy him tea, and he smiled cordially, sipped a bit, and hid sugar in the pocket of his jacket. """"I'll treat the kids,"""" he said.","Zelensky (general), Zelensky's style",Ukraine,Ukrainian,News photo,Zelensky,for balance,https://drive.google.com/file/d/11iv4WLg50iMF8wd7GVSlh4xkD_xMZ-jo/view?usp=share_link
2023-01-04T01:58:15.000Z,12/7/2022,Petro of the year / Time,https://t.me/ukrainearmedmemes/626,,Active Poroshenko,Ukraine,Ukrainian,News photo,Poroshenko (Petro),Petro of the year,https://drive.google.com/file/d/153WTqBQZwdr7DyPcJRN8r65jVkFU-fCB/view?usp=share_link
2023-01-04T03:02:33.000Z,12/13/2022,":) Анекдот від Президента
Два одесита - одеських єврея. Вони зустрічаються і один іншому каже: ""Ну шо, як там ситуація? Що там говорять""?
""Ну шо. Говорять, що війна"". 
""Шо за війна""?
""Росія воює з НАТО"".
Той: ""Серйозно""?!
""Да, да, війна. Росія воює з НАТО"".
""І шо, як там""?
""Ну росіяни: 70000 військових загинуло, всі ракети майже витратили вони, багато техніки поламано, підірвано. Отака ситуація"".
Он говарить: ""А шо НАТО""? 
""Ну шо НАТО? НАТО ще не підїхало"".
(емодзі: вогонь) то пан Леттерман ще приколів з фейсбуку не читав",https://t.me/ukrainearmedmemes/631,":) Anecdote from the President
Two Odesians, Odesa Jews. They meet and one another says, ""Well, how's the situation there? What do they say?""
""Well, they say it's a war."" 
""What for a war""?
""Russia is at war with NATO"".
The one: ""Seriously""?!
""Yes, yes, it is a war. Russia is at war with NATO.""
""And what, what is there?""
""Well, the Russians: 70000 soldiers perished, they almost spent all the missiles, a lot of equipment was broken, blown up. That's the situation.""
Oh, ""What about NATO?"" 
""Well, what about NATO? NATO hasn't arrived yet.""
 (emoji: fire) Mr. Letterman has not yet read jokes from Facebook","Russia (general), War progress / outcome (general), Zelensky (general)","Ukraine, Russia, NATO countries",Ukrainian,TV show,Zelensky,anecdote frome Zelenskyi,https://drive.google.com/open?id=1lEzqTXce1b_SiUF7ODIjGm3QiFOAGMRL
2023-01-04T03:10:49.000Z,12/5/2022,"Сирник, це що місячні?",https://t.me/ukrainearmedmemes/624,"Hey Mater, are you on period?","Russian troops (general), Ukrainian troops (general), War progress / outcome (general)",Ukraine,Ukrainian,Film (non-Soviet),,cars,https://drive.google.com/open?id=1iRCjzagxijoY-L04ov2KyVCklKCzRuXN
2023-01-04T05:48:46.000Z,11/30/2022,Scientists Can Now Transform Stress into Electricity. Swiss researchers created a new material that produces electricity when twisted and stretched. -- Україна з космосу:,https://t.me/ukrainearmedmemes/621,Scientists Can Now Transform Stress into Electricity. Swiss researchers created a new material that produces electricity when twisted and stretched. -- Ukraine from space:,Power shortages in Ukraine,Ukraine,"Ukrainian, English",Map,,Ukraine space,https://drive.google.com/open?id=1mhsjYqX2mZq2iaVPWRon4gqcAtdWJFCT
2023-01-04T06:23:27.000Z,12/1/2022,"- Ми уничтожим всю вашу инфраструктуру!1!1! - Ну, давай, хулі ти?",https://t.me/ukrainearmedmemes/622,"- We'll destroy your entire infrastructure!1!1! - Well, go ahead, what the f*ck stops you?",Power shortages in Ukraine,Ukraine,"Ukrainian, Russian",TV show,,infrastructure_download,https://drive.google.com/open?id=1g2Herdbxt6wWRCktRpXQNpRN2BVNTHq1
2023-01-04T07:31:33.000Z,11/20/2022,"Як знайти своїх однокласників, якщо ти з Донецька: OK -- Миротворець Pro Bono Publico",https://t.me/ukrainearmedmemes/613,How to find your classmates if you are from Donetsk: OK -- Peacemaker Pro Bono Publico,"Collaborators in Ukraine, Civilian resistance in Ukraine",Ukraine,Ukrainian,Drake yes/no,,ok fb,https://drive.google.com/open?id=1gOJ8t7uqNTVBxab12d-6ua2B5StL0S2e
2023-01-04T08:10:23.000Z,11/18/2022,Планові відключення світла -- Планові включення світла,https://t.me/ukrainearmedmemes/611,Planned power outages -- Planned light turning on,Power shortages in Ukraine,Ukraine,Ukrainian,Film (non-Soviet),,light shortage,https://drive.google.com/open?id=1q19-xjnWLPaTf9GPLrN2OezpffE8qDPC
2023-01-04T08:21:34.000Z,11/14/2022,Я -- прогнози Буданова: - Це моя любов. Це мій найкращий друг. Це моя енергія.,https://t.me/ukrainearmedmemes/607,Me -- Budanov's predictions: - That's my love. That is my best friend. That's my energy.,"War progress / outcome (general), Zelensky (general)",Ukraine,Ukrainian,TV show,"Zelensky, Zelenska (Olena)",Budanov forecasts,https://drive.google.com/open?id=1CRGLCNG61jmjev2MAibG2qw-R61arfU4
2023-01-04T16:58:57.000Z,1/2/2023,"Мама, я умер на Украине, и с наших трупов делают мем",https://t.me/nexta_live/44160?comment=1783443,"Mom, I died in Ukraine, and they are making a meme with our corpses","Russian troops (general), Memes (yes - memes about memes!)","Ukraine, Russia",Russian,Corpses message,,photo_2023-01-04_19-56-37,https://drive.google.com/open?id=12qb-CSTdZCWqk3AKu7-wlNvr3dtLIwO3
2023-01-04T17:01:44.000Z,1/2/2023,Перестаньтi нас перекладувать туда-сюда,https://t.me/nexta_live/44160?comment=1783467,Stop moving us back and forth,Russian troops (general),"Ukraine, Russia","Ukrainian, Russian",Corpses message,,photo_2023-01-04_19-59-11,https://drive.google.com/open?id=1N2e-Je3o_DvPuIdAlK7P6auNxRW1oLkH
2023-01-04T17:05:12.000Z,1/2/2023,[Bandera's portrait made out of corpses of Russian soldiers],https://t.me/nexta_live/44160?comment=1783474,,Russian troops (general),"Ukraine, Russia",n/a,Corpses message,Bandera (Stepan),photo_2023-01-04_20-02-42,https://drive.google.com/open?id=1EWduT_t2vknI6N1a3yUAYs6ZIrAyrUPH
2023-01-05T02:48:45.000Z,1/4/2023,Кількість годин витрачених Зе на розмову з Макроном: 4 годин -- 20 годин -- 40 годин -- 50+ годин (?),https://t.me/ukrainearmedmemes/677,The number of hours Ze spent talking to Macron:  4 hours -- 20 hours -- 40 hours -- 50+ hours (?),"Lend-Lease and other military assistance to Ukraine, Macron on the phone",Ukraine,Ukrainian,Infographics,,Macron,https://drive.google.com/open?id=128x3JL1PVk3wcaj2gh1Tp2Tf7mI0M61I
2023-01-05T03:06:59.000Z,12/16/2022,Який ти Буданов сьогодні? Радісний -- сумний -- романтичний -- злий.,https://t.me/ukrainearmedmemes/636,Which Budanov are you today? Joyful -- sad -- romantic -- angry.,Ukrainian troops (general),Ukraine,Ukrainian,News photo,Budanov (Kyrylo),Budanov`s emotions,https://drive.google.com/open?id=1eRk_sT-AM4TmHWXF7Qen-GSpqoW5qKMC
2023-01-05T03:43:12.000Z,11/15/2022,"Секретний проєкт ГУР та ""Повернись живим"".",https://t.me/ukrainearmedmemes/608,"Secret project of Defence Intelligence of Ukraine and ""Come Back Alive"".","Ukrainian troops (general), Marauding, Russian troops (general)",Ukraine,Ukrainian,Stock photo,,secret project,https://drive.google.com/open?id=1Yjr55i7UZSszC1aPHZxk_SNg2ZJW-Jzz
2023-01-05T04:04:46.000Z,11/11/2022,Сигнал телефонів в Херсоні,https://t.me/ukrainearmedmemes/601,Phone signal in Kherson,"Russian troops (general), Ukrainian troops (general), War progress / outcome (general), Deoccupation",Ukraine,Ukrainian,"Film (non-Soviet), Map",,phone signal,https://drive.google.com/open?id=10zyO9xQEZcaIV0SQLqgFIlJw1WZcIqxV
2023-01-05T04:18:10.000Z,11/22/2022,"Що побачила СБУ, коли прийшла в Лавру.",https://t.me/ukrainearmedmemes/615,What the Security Service of Ukraine saw when it came to Lavra.,Ukraine (general),Ukraine,Ukrainian,"Film (non-Soviet), Screenshot",,Lavra,https://drive.google.com/open?id=1_8XSaW3majMkfGB6MVzpEayOHY60It8M
2023-01-05T04:48:44.000Z,11/10/2022,Roshen - Herson,https://t.me/ukrainearmedmemes/597,,Active Poroshenko,Ukraine,English,News photo,Poroshenko (Petro),Roshen-Herson,https://drive.google.com/open?id=1tv2O1uGSYK0oNEexh7ozOzunK-fjFUSa
2023-01-05T06:15:15.000Z,11/9/2022,Херсонщина: Кирил Стремоусов - мандрівник на той світ.,https://t.me/ukrainearmedmemes/593,Kherson region: Kirill Stremousov is a traveler to a better place,Mobilization / military draft / recruitment in Russia,Ukraine,Ukrainian,News photo,,traveller,https://drive.google.com/open?id=18FcLugTNAWPLp4tU5mxYcDOlDDabPJMq
2023-01-05T06:34:16.000Z,11/8/2022,"Довіряйте офіційним джерелам, там все чітко і зрозуміло. Офіційні джерела:",https://t.me/ukrainearmedmemes/591,"Trust the official sources, in them everything is precise and clear. Official sources:","Air-raid alarms, Ukraine (general), War news - dealing with them",Ukraine,Ukrainian,Screenshot,,official news,https://drive.google.com/open?id=1OclMTyxkKiU_BN4C8xq9GB0NmFSYu-Rb
2023-01-05T06:40:35.000Z,1/4/2023,Трохи не дійшли до Києва,https://www.facebook.com/photo.php?fbid=5999247490126722&set=p.5999247490126722&type=3,Almost made it to Kyiv,Russian troops (general),"Ukraine, Russia",Ukrainian,Corpses message,,322509160_663410135525122_3442670656533180153_n,https://drive.google.com/open?id=1EL8Cx39fzHx9mKk8Z8W20EX-LxZ_bbo6
2023-01-05T06:44:23.000Z,1/4/2023,Досить ображати свиней i собак,https://www.facebook.com/photo.php?fbid=6060602437323478&set=p.6060602437323478&type=3,"Stop insulting pigs and dogs [""pig-dog"" (""svynosobaka"" is a Ukrainian insult for Russian soldiers]",Russian troops (general),"Ukraine, Russia",Ukrainian,Corpses message,,324071135_599617178641337_50622911685520716_n,https://drive.google.com/open?id=1rUPffC4DCUrMyOJC8DVUcOKW8U7C30ly
2023-01-05T06:46:08.000Z,1/4/2023,Та покладіть нас уже в пакет,https://www.facebook.com/photo.php?fbid=6060602117323510&set=p.6060602117323510&type=3,Put us in a bag already,"Garbage bags (dead Russian soldiers), Russian troops (general)","Ukraine, Russia",Ukrainian,Corpses message,,324119766_475046308148843_8646670619573690037_n,https://drive.google.com/open?id=1xOP6reRmqGKeVAgeUoEiV_U3jH4qrUUn
2023-01-05T06:48:18.000Z,1/4/2023,Скока можна нас тягать по снегу,https://www.facebook.com/photo.php?fbid=6060602220656833&set=p.6060602220656833&type=3,How much longer are you going to drag us over the snow,Russian troops (general),"Ukraine, Russia",Russian,Corpses message,,324018223_562075382141879_739906786582706529_n,https://drive.google.com/open?id=17FELUM7kfQ1bdtYxNZs26niyVIV4LRyS
2023-01-05T06:50:58.000Z,1/2/2023,Прєкратiте убiвать русскiх радi надпiсей,https://www.facebook.com/photo.php?fbid=6194171500595420&set=p.6194171500595420&type=3,Stop killing Russians to make captions,Russian troops (general),"Ukraine, Russia","Russian, Ukrainian","Corpses message, News photo",,323730516_986554816065705_2700217038258440468_n,https://drive.google.com/open?id=1M1lVRMxR22klkzjuKdyD7qKN5zyabFx3
2023-01-05T07:32:35.000Z,11/8/2022,POV: Пошук роботи в 2022 році,https://t.me/ukrainearmedmemes/590,POV: Job search in 2022,Economic impact of the war,Ukraine,Ukrainian,"Animal photo, Film (non-Soviet)",,Work searching,https://drive.google.com/open?id=1M-m_hxSZ9Rpy3--o_Q9-I6vTpYTR-Fbp
2023-01-05T14:06:26.000Z,12/21/2022,"- ATACAMS, Abrams, Patriot, F-16, що ще треба? - Нормальну клавіатуру для Ермака. Бо він своїми ребусами вже заїб@в всіх",https://t.me/ukrainearmedmemes/645?comment=6011,"- ATACAMS, Abrams, Patriot, F-16, what else is needed? - Normal keyboard for Ermak. Because he has already f@cked everyone up with his puzzles","Lend-Lease and other military assistance to Ukraine, Zelensky visits USA (December 2022), Yermak's puzzles","Ukraine, United States","Ukrainian, English",News photo,"Zelensky, Biden, Yermak (Andrii)",photo_2023-01-05_16-58-14,https://drive.google.com/open?id=1IElgrOqfvb6fyZ4cHR5uTh3W8phJ9UaL
2023-01-06T09:59:04.000Z,1/6/2023,"- What new meme you got today man? - Check it out man, got some Vladimir Pooptin his pants, Where Rogozin penis? and What Engel's base doing?",https://twitter.com/KVIST1984/status/1611307012821815296,,"Memes (yes - memes about memes!), Putin soils his pants",Russia,English,Stock photo,Putin,Meme-Dealer,https://drive.google.com/open?id=1FchmQ-bErXEb4s-Z1DhbW7XieQbcmc8W
2023-01-07T15:44:58.000Z,11/18/2022,"Я все посилаю їм випробування, а вони роблять про це меми і сміються",https://t.me/ukrainearmedmemes/611?comment=5513,"I keep testing them, but they make memes about it and laugh","Civilian resistance in Ukraine, Memes (yes - memes about memes!), Ukraine (general)",Ukraine,Ukrainian,Artwork,Jesus Christ,photo_2023-01-07_18-32-47,https://drive.google.com/open?id=1KpW2GaWsuN7uMxJCBfZW4dWHYqZCqN7C
2023-01-09T01:59:02.000Z,1/7/2023,"- Неет, я сказал гейропа замерзает без нашего газа!!!!!!!!!! Вы там от холода все подохнете!!! -- Погода в Берлине сейчас +10°. Пасмурно. Ощущается как +6°. Вчера в это время +10°. -- Тверской район, Москва сейчас -19°. Ясно. Ощущается как -24°. Вчера в это время -20°.",https://t.me/ukrainearmedmemes/679,"- Noо, I said gayropa freezes without our gas!!!!!!!!!! You're all going to freeze to dealth there!!! -- Weather in Berlin now +10°. Overcast. Feels like +6°.Yesterday at this time +10°. -- Tverskoy District, Moscow now -19°. Clear. Feels like -24°. Yesterday at this time -20°.",Russian gas,"Russia, European Union",Russian,Cartoon,,Geyropa,https://drive.google.com/open?id=1v_nVFqmER3tGrnY1b66JmzASFbxF4qRt
