Timestamp,Date Posted,Title,Source Url,Translated Title,Meme Content Type,Country,Language,Meme Template Type,People,Original Filename,Google Drive Link
2022-10-19T20:24:56.000Z,10/18/2022,"Why is it, when vatniks are upset, it is always you three? -- Estonia Latvia Lithuania",https://twitter.com/BadBalticTakes/status/1582450132821635073,,Russia (general),"Estonia, Latvia, Lithuania, Russia",English,Harry Potter,,vatniks-upset.jpg,https://drive.google.com/open?id=1fAo6ehChVmWKJZLne6dqenURkkUFIXu1
2022-10-20T11:02:17.000Z,10/2/2022,May the Fella be with you,https://twitter.com/itsMontaybaybay/status/1576598142232846337,,Ukraine (general),Ukraine,,"NAFO / Shiba Inu, Star Wars",,may-fella-be-with-you.jpg,https://drive.google.com/open?id=18O9UtOhsG_Q5MXv5ry5HfIQTYGQR3R9_
2022-10-21T15:44:28.000Z,9/25/2022,I wants visas! Gives me! Russia bad! -- You gives...? No??! Mighty Russia will crushes you!,https://twitter.com/DefenceU/status/1574131831921860608,,"Russian exodus, Sanctions and import substitution","Russia, European Union",English,Lord of the Rings (film),,FdhwhaLXwAcx8re,https://drive.google.com/open?id=1oc5LLzGimxcBHKMoTGjHFb4S92Yzl8-M
2022-10-21T15:48:53.000Z,10/21/2022,[The Motherland Monument in Kyiv holds Putin's head in victoriously raised hand],https://www.facebook.com/photo.php?fbid=8212817088790157&set=p.8212817088790157&type=3,,"Putin (general), Ukraine (general), War progress / outcome (general)","Ukraine, Russia",n/a,Artwork,Putin,311125609_8212817058790160_551170327733287471_n,https://drive.google.com/open?id=1LTbwweg1kKjf9Qt1CdktH5hkAOuOU1Bf
2022-10-21T15:52:57.000Z,10/21/2022,"- Новая коллекция - Ну, жених",https://www.facebook.com/photo.php?fbid=5771056646279039&set=p.5771056646279039&type=3,_ The latest collection - Like a bridegroom,"Putin (general), Mobilization / military draft / recruitment in Russia  , Russian troops (general)",Russia,Russian,,Putin,311769861_5771056632945707_8850431416573641501_n,https://drive.google.com/open?id=1rsyHS5ahtRXig0WHKJ7fycmMAc_VGBpo
2022-10-21T16:02:24.000Z,10/20/2022,[Photos of Surovikin and Putin are compared to the photo of Dr. Evil and Mini-Me],https://www.facebook.com/photo.php?fbid=5623378184375652&set=p.5623378184375652&type=3,,"Putin (general), Russian troops (general)",Russia,n/a,"Film (non-Soviet), News photo","Putin, Surovikin (Sergei)",,https://drive.google.com/open?id=1rNeN-eXKfaV3JFHZtibBGN6ucpwkFl-u
2022-10-21T17:00:57.000Z,10/21/2022,Хватит курить где попало. Курите где еще не попало!,https://vk.com/lentach?z=photo-29534144_458653713%2Fwall-29534144_19273585,Stop smoking god knows where. Smoke you know where!,"""Smoking"" causing explosion (according to Russian propaganda)","Ukraine, Russia",Russian,TV show,,jLkNxH7qH8M,https://drive.google.com/open?id=1VAz4E4cGSD5534w1HvZW4bRRvuQGIdzL
2022-10-21T17:09:41.000Z,8/24/2022,По три рази за нiч... Три рази за нiч... : Увага! Оголошена повiтряна тривога! [...],https://www.rbc.ua/ukr/styler/memy-voyny-kakie-shutki-pobedim-bitve-nezavisimost-1661176165.html,Three times in one night... Three times in one night... : Attention! An air alarm has been announced! [...],Air-raid alarms,Ukraine,Ukrainian,Stock photo,,7triv,https://drive.google.com/open?id=1_2gh7qqqMrsnRJTpvVezjWQXKYBSfyAF
2022-10-21T17:13:06.000Z,8/24/2022,Бiгти в укриття чи ну його?,https://www.rbc.ua/ukr/styler/memy-voyny-kakie-shutki-pobedim-bitve-nezavisimost-1661176165.html,Should I run to the shelter or not to bother?,Air-raid alarms,,Ukrainian,Artwork,,image_90,https://drive.google.com/open?id=1btBwPwwLWvNFXvwt0QIEE8WuKCVNrYl6
2022-10-23T06:46:13.000Z,8/17/2022,"[A giant cat destroys tanks marked with letter ""Z""]",https://twitter.com/giantcat9/status/1560015108922900483/photo/1,,War progress / outcome (general),"Ukraine, Russia",n/a,Giant military cats,,FaZJAvIWIAMUHpE,https://drive.google.com/open?id=114JoAVgsgbhcN52a2wHO8WfTlJIGb528
2022-10-23T19:09:59.000Z,10/23/2022,"- Шарик, к ноге - Куда идти? Что происходит?",https://t.me/nexta_live/39425?comment=357184,"- Fido, by my leg! - Where to go? What's happening?",Russian troops (general),Russia,Russian,"News photo, Animal photo",,photo_2022-10-23_22-04-22,https://drive.google.com/open?id=1sMoPqKtxohDMbW48sm-StErEYNHGfu2Z
2022-10-24T03:09:04.000Z,10/24/2022,"Поцілувати, загадати Бажання, взяти за руку, задуматись чи це точно була зірка *лять",https://t.me/s/muswm,"Kissing, making a wish, taking by the hand, wondering it was really a fucking star",Air-raid alarms,,Ukrainian,Artwork,,A shooting star,https://drive.google.com/open?id=1OkQgf2fJGBWTYwhHHkG10LQIWX8CrbUf
2022-10-24T03:16:28.000Z,10/24/2022,Донецьк після деокупації,https://t.me/muswm,Donetsk after de-occupation,"War progress / outcome (general), Deoccupation",Ukraine,Ukrainian,Artwork,,Donetsk after de-occupation,https://drive.google.com/open?id=1rGvtj4JOLkYLi4fE1B-Hm7H-wW_bnQd8
2022-10-25T13:26:53.000Z,10/25/2022,"[Russian soldier's lifecycle: from a larva to a white ""Lada""]",https://t.me/muswm/3797,,"Car as compensation for a fallen son, Russian troops (general)",Russia,n/a,"Chmonia the Russian occupier, Infographics",,photo_2022-10-25_08-45-46,https://drive.google.com/open?id=1j32lzUpDQ3yAmjACuvSJIMWwpx2Q5YkH
2022-10-25T13:33:02.000Z,10/24/2022,[A Russian soldier is reflected in the mirror as a body bag],https://t.me/luxta_tv/5166?comment=568888,,"Garbage bags (dead Russian soldiers), Russian troops (general)","Ukraine, Russia",n/a,Stock photo,,photo_2022-10-25_16-31-11,https://drive.google.com/open?id=1fI5EWjzCw9cZEKGY0M8cvyobHsIm3eLX
2022-10-25T13:46:55.000Z,10/25/2022,"Каждый раз, когда ты пересылаешь это фото, случайная ""сушка"" падаетна жилой дом. - Сушку?",https://t.me/nexta_live/39559?comment=402268,"Every time you forward this photo, а random little SU [airplane] falls on an apartment building in Russia. - Would you like a little SU?","War progress / outcome (general), ""Sushka"" (a ""little SU"" military plane)","Ukraine, Russia",Russian,Animal photo,,photo_2022-10-25_16-41-20,https://drive.google.com/open?id=1xaLeGZ1YaF5HZ-PHIlcHhHJ2f89NpzWz
2022-10-25T13:50:46.000Z,10/25/2022,[Putin as devil],https://t.me/nexta_live/39559?comment=402720,,Putin (general),Russia,n/a,"Artwork, News photo",Putin,photo_2022-10-25_16-49-10,https://drive.google.com/open?id=1D0EFLp_tmOWmAaj8IN18nBA-fObSvaHK
2022-10-25T13:56:44.000Z,10/25/2022,"Украина применила ""грязную бомбу"" в российском Омске. [...]",https://t.me/nexta_live/39559?comment=401843,"Ukraine used a ""dirty bomb"" in Russian Omsk. [...]",Russia (general),"Ukraine, Russia",Russian,News photo,,photo_2022-10-25_16-54-33,https://drive.google.com/open?id=1ynoNEQj1-eqoN3ekIYBfRD37a8SDt80F
2022-10-26T00:08:38.000Z,,"1051: Anna Yaroslavna (Anne de Kiev) was a French queen consort as wife of Henry I in 1051-1060 [...] -- 1051: Meanwhile, in Moscow...",https://knowyourmeme.com/search?context=images&q=Ukraine,,"Ukraine (general), Russia (general)","Ukraine, Russia",English,Infographics,Anne of Kiev,Anne_de_Kiev_Sucho_Meme,https://drive.google.com/open?id=1rzAigR3HgAZIX5-2fASIFu20nCsus_z2
2022-10-26T00:15:44.000Z,,- We need air support! - You can do it!,https://knowyourmeme.com/search?context=images&q=Ukraine,,"Lend-Lease and other military assistance to Ukraine, Concessions to Putin / wavering support for Ukraine","Ukraine, Germany",English,War photo,,We_Need_Air_Support_Sucho_Memes,https://drive.google.com/open?id=195UJLCBrX1uHgme1DBBKYmg5_5r5azFb
2022-10-26T00:26:22.000Z,,Going to fight in Ukraine International Legion... Turned away because I don't have combat experience,https://knowyourmeme.com/search?context=images&q=Ukraine,,"Ukrainian troops (general), Foreign fighters in Ukraine",Ukraine,English,Stock photo,Obama,Going_to_Fight_in_Ukraine_International_Legion_Sucho_Memes.png,https://drive.google.com/open?id=1avNv_T7OcQNdkyt30a-2eGAvJEQBtvxn
2022-10-26T00:59:21.000Z,,Surrender!,https://knowyourmeme.com/search?context=images&page=2&q=Ukraine,,War progress / outcome (general),"Ukraine, Russia",English,Rage comics,,Surrender_Sucho_Memes,https://drive.google.com/open?id=1-DJiUqN2E40eWCFmKdooIM8EJm-Nrw2D
2022-10-26T01:03:31.000Z,,Russian articles about Ukraine that mention Nazism,https://knowyourmeme.com/search?context=images&page=2&q=Ukraine,,Russian propaganda and state media,"Ukraine, Russia",English,Infographics,,Russian_Articles_About_Ukraine_That_Mention_Nazism_Sucho_Memes,https://drive.google.com/open?id=12PyQgectN-SDVPRelx-nSWI_hHxtvLok
2022-10-26T01:14:29.000Z,,When you sleep in Ukraine and woke up in Russia,https://knowyourmeme.com/search?context=images&page=2&q=Ukraine,,Deoccupation,"Ukraine, Russia",English,Film (non-Soviet),,When_You_Sleep_In_Ukraine_And_Wake_Up_In _Russia_Sucho_Memes,https://drive.google.com/open?id=107yOoW7J_guJywm28r8RrJY0eLAhzkMg
2022-10-26T01:57:54.000Z,,"- Grandfather, Ukraine and Russia are fighting there! - With whom?",https://knowyourmeme.com/search?context=images&page=2&q=ukraine,,"Russia (general), Ukraine (general)","Ukraine, Russia",English,Rage comics,,Zoomer_Vs_Goomer_Sucho_Memes,https://drive.google.com/open?id=1FG1oRVBODRS5XnhL2rFg41J6D6rc7467
2022-10-26T02:02:15.000Z,,Plants vs Zombies: Ukraine Edition,https://knowyourmeme.com/search?context=images&page=2&q=ukraine,,"Russian troops (general), Ukraine (general)","Ukraine, Russia",English,Poster,,Plants_vs_Zombie_Ukrain_Edition_Sucho_Memes,https://drive.google.com/open?id=14nxchaL5CzsC3rmxBVaQ10VtZ6nPIsrT
2022-10-26T02:16:51.000Z,,Russia -- Not Russia,https://knowyourmeme.com/search?context=images&page=3&q=ukraine,,"Russia (general), Ukraine (general)","Ukraine, Russia",English,Map,,Geography_Can_Be_Tough_Sucho_Memes,https://drive.google.com/open?id=1Ck4pr6frOl9USjjApMAeLbx142yPFJxe
2022-10-26T03:16:55.000Z,10/8/2022,Кримський міст. З днем Копченного мосту!,https://www.unian.ua/curiosities/krimskiy-mist-vso-naykrashchi-zharti-ta-memi-pro-bavovnu-12003918.html,Crimean bridge. Happy Smoked Bridge Day!,"Kerch bridge to Crimea, Crimea (explosions etc.)","Ukraine, Russia",Ukrainian,Stock photo,,Z dnem Kopchenoho Mostu,https://drive.google.com/open?id=1pv3n7Wg8DWUoTTmnvwZOBjTEtTvwO4FM
2022-10-26T03:21:56.000Z,10/8/2022,"[Zelensky cooking on a grill on top of the Crimean bridge, as the bridge catches fire]",https://www.unian.ua/curiosities/krimskiy-mist-vso-naykrashchi-zharti-ta-memi-pro-bavovnu-12003918.html,,"Kerch bridge to Crimea, Ukraine's heros (individual), Crimea (explosions etc.)","Ukraine, Russia",n/a,,Zelensky,Grill a la Zelenskyi,https://drive.google.com/open?id=1HsEWGHptZ6aWqIlki3L6aVJGaxtp8I6b
2022-10-26T03:25:41.000Z,10/8/2022,"[A Youtube video Russian lady crying because she is forced to flee Crimea, because ""it's so home-like here,"" and the burning Crimean bridge]",https://www.unian.ua/curiosities/krimskiy-mist-vso-naykrashchi-zharti-ta-memi-pro-bavovnu-12003918.html,,"Kerch bridge to Crimea, Crimea (explosions etc.)","Ukraine, Russia",Ukrainian,News photo,,""" ...so homely here""",https://drive.google.com/open?id=1eomhVE7WvjyLG0Ytf3ALgbg20Tl6oi8i
2022-10-26T03:34:31.000Z,10/8/2022,"Фільм Валерия Залужного. Влодимер Путен : Полуостров проклятіх. ""Вообще не хочу уезжать из Крима..."" Netflix - FilmUA. Этой осенью",https://www.unian.ua/curiosities/krimskiy-mist-vso-naykrashchi-zharti-ta-memi-pro-bavovnu-12003918.html,"Valery Zaluzhny's film. Vladimir Puten : Peninsula of the damned. ""I really do not want to leave Crimea..."" Netflix - FilmUA. This fall","Putin (general), War progress / outcome (general), Crimea (explosions etc.)","Ukraine, Russia","Russian, Ukrainian",Poster,"Putin, Zaluzhnyǐ (Valeriǐ)",Poluostrov Proklatych - Alexandra BSB,https://drive.google.com/open?id=1mfZ4F3dxMBqOmsVXSVKBU4qkzkT1Mkyx
2022-10-26T23:19:11.000Z,,[Many Putins sitting at the long table that ends in Ukraine],https://knowyourmeme.com/search?context=images&page=3&q=ukraine,,Putin keeping his distance,"Ukraine, Russia",n/a,The long table,Putin,You_Will_Never_Reach_Ukraine_Sucho_Memes,https://drive.google.com/open?id=1T-8DaFzubTR1daMULxFB3yse_JiSr8EU
2022-10-26T23:29:31.000Z,,Russian and American troops looking at each other across the Euphrates in Syria after Russian invades Ukraine,https://knowyourmeme.com/search?context=images&page=3&q=ukraine,,"Russia (general), Russian troops (general)","Russia, United States",English,Turning Monkey Meme,,Russian_And_America_Troops_looking_At_Each_Other_Across_The_Euphrates_Sucho_Meme,https://drive.google.com/open?id=1C-zB1IfXwT2xrVfz9WkzboItMaR6_2nN
2022-10-26T23:35:41.000Z,,“We will seek to demilitarize and denafizy Ukraine…“,https://knowyourmeme.com/search?context=images&page=3&q=ukraine,,Putin as Hitler,"Russia, Germany",English,Historical photo,"Putin, Hitler",History_May_Not_Repeat_Itself_Sucho_Memes.jpg,https://drive.google.com/open?id=15difvVmwBEUacTf2yp9XZfm54g8M1wKB
2022-10-27T00:15:30.000Z,,"[Putin in Scream by E. Munk, next to the burning Crimean bridge]",https://knowyourmeme.com/search?context=images&page=3&q=ukraine,,"Kerch bridge to Crimea, Kerch bridge to Crimea, Crimea (explosions etc.)","Ukraine, Russia",n/a,Artwork,Putin,Kerch_Bridge_Sucho_Memes,https://drive.google.com/open?id=1sEsRRSd31OWYPBte5bkkKwnDU3RtIEoc
2022-10-27T02:00:30.000Z,,Vladimir Putin European Tour,https://knowyourmeme.com/search?context=images&page=8&q=ukraine,,"Putin (general), War progress / outcome (general)","Ukraine, Russia, European Union",English,Poster,Putin,Vladimir_Putin_European_Tour_Sucho_Memes,https://drive.google.com/open?id=1Ii9YkdJdzB8CV-s4RJ5slRmFxUxuWtJG
2022-10-27T02:24:49.000Z,,Tintin et l´invasion illégale de l´Ukraine,https://knowyourmeme.com/search?context=images&page=9&q=ukraine,Tintin and the illegal invasion of Ukraine,"Ukrainian troops (general), Foreign fighters in Ukraine","Ukraine, Russia, Belgium",French,Book cover / illustration,,Tintin_Et_Linvasion_Illégale_de_LUkraine_Sucho_Memes.jpg,https://drive.google.com/open?id=1QaZ-a1nz8_4VRHAWy50TJRFBvu3271PO
2022-10-27T02:29:43.000Z,,Types of headaches,https://knowyourmeme.com/search?context=images&page=7&q=Ukraine,,Russia (general),"Russia, Ukraine",English,Infographics,,Types_Of_Headaches_Sucho_Memes,https://drive.google.com/open?id=11LzCGVYKQutgDSg4yxeqK9vfewyUD0LD
2022-10-27T02:31:30.000Z,,Not Ukraine - Mykraine,https://knowyourmeme.com/search?context=images&page=7&q=Ukraine,,Putin (general),"Ukraine, Russia",English,Stock photo,Putin,Not_Ukraine_Mykraine_Sucho_Memes,https://drive.google.com/open?id=1-taTs5ZieOHpyO55Qm25QIRuYeJJSxe5
2022-10-27T02:39:10.000Z,,Franklin goes to Ukraine,https://knowyourmeme.com/search?context=images&page=7&q=Ukraine,,"Ukrainian troops (general), Foreign fighters in Ukraine","Ukraine, Canada",English,Book cover / illustration,,Franlin_Goes_To_Ukraine_Sucho_Memes,https://drive.google.com/open?id=1475I7rkCEwrFOrJuANWIsd1TWQVetY3y
2022-10-27T16:54:38.000Z,10/27/2022,"Помните! Это орудуют мошенники. Не дайте себя обмануть! Ни в коем случае не давайте денег ""на экипировку российской армии""! [...] Путин все проверил! Российская армия полностью всем обеспечена!",https://t.me/luxta_tv/5183,"Remember! This is a scam. Don't be fooled! In no case give money ""for the equipment of the Russian army""! [...] Putin checked everything! The Russian army is fully provided with everything!","Putin (general), Mobilization / military draft / recruitment in Russia  , Russian troops (general)",Russia,Russian,Poster,Putin,photo_2022-10-27_19-49-48,https://drive.google.com/open?id=144_x-PPNyEw8FeVNS8RRDJUj2lDdSbpu
2022-10-28T01:06:18.000Z,9/11/2022,"50,000",https://vsim.ua/Podii/kontrnastup-50-tisyach-ta-neperemozhni-zsu-dobirka-memiv-pro-viynu-11677907.html,,"Russian troops (general), War statistics","Ukraine, Russia",n/a,"News photo, Stock photo",Zaluzhnyǐ (Valeriǐ),50 000,https://drive.google.com/open?id=1CuMDJ4toRn728iQbAC6-NN1gWvfufTsz
2022-10-28T02:38:36.000Z,3/6/2022,Russian complaining on how ashamed they feel -- Ukrainians,https://life.pravda.com.ua/society/2022/03/6/247695/,,"Russian opposition, Ukraine (general)","Ukraine, Russia",English,Mel Gibson Talking to Bloody Jesus,,The Difference,https://drive.google.com/open?id=1-HlJhejYQ1cRuFJ3wz7IKqQ_EGqLCEeW
2022-10-28T02:49:50.000Z,3/6/2022,"Коли в державі все погано і навколо кажуть, що пора ""валити"", малоросс питає ""куди?"", а українець - ""кого?""",https://in.pinterest.com/pin/31032684921664971/,"When everything is bad in the state and people around say that it is time to ""end with it"", the ""Little Russian"" asks ""where to?"", and the Ukrainian - ""whom?""",Ukraine (general),Ukraine,Ukrainian,Film (non-Soviet),,Ukrainian and Little Russian,https://drive.google.com/open?id=1rOymvx3NHyM2ztP628Xd-1emDnKBE79M
2022-10-28T02:54:07.000Z,,"Tут Україна, люби її, або вали звідси на *уй",https://www.pinterest.com/pin/665547651170938221/,"This is Ukraine, love it or get the f*ck out of here",Ukraine (general),Ukraine,Ukrainian,Poster,,,https://drive.google.com/open?id=17wQ0c6guNeFxo1lfTq2lYu0HjCcW5-AN
2022-10-28T12:55:30.000Z,10/28/2022,Why would NATO make me do this?,https://twitter.com/DarthPutinKGB/status/1585945480357244929,,Russia (general),"Ukraine, Russia",English,TV show,Putin,why_would_not_make_me_do_this.jpg,https://drive.google.com/open?id=1EAmFrCRtFiaCyjg4LBlWMkjtMd77xzhF
2022-10-28T13:01:14.000Z,10/28/2022,[Mad Max HIMARS],https://twitter.com/akinak1776/status/1586082709629063168,,"Ukrainian troops (general), Lend-Lease and other military assistance to Ukraine",Ukraine,n/a,Film (non-Soviet),,mad_max_himars.jpeg,https://drive.google.com/open?id=1Yc1lTu36WBZQMV7qK_5oVkyxk28e_7A9
2022-10-28T13:13:18.000Z,10/26/2022,Russia is a terrorist state,https://twitter.com/JoppeJuu/status/1585301506198499328,,Russia (general),Russia,English,TV show,,bart_simpson_russia_is_a_terrorist_state.jpeg,https://drive.google.com/open?id=1fJFf5jMOFYOJg7SJJ1bTf3a-ckvUBEgm
2022-10-28T13:22:13.000Z,10/25/2022,Ikea returns to Russia,https://twitter.com/IanKuah/status/1584890258076102656,,"Sanctions and import substitution, Russian troops (general)",Russia,English,Infographics,,ikea_returns_to_russia.jpeg,https://drive.google.com/open?id=1mkt7qxekiAh1A_oevOJOvkPOwAu-LQel
2022-10-28T13:37:07.000Z,9/25/2022,Власть - долой! Солдат - домой!,https://t.me/nexta_live_russia/2852,Off with the authorities! The soldiers to be returned home!,"Russian troops (general), War progress / outcome (general)",Russia,Russian,Poster,,photo_2022-10-28_16-33-04,https://drive.google.com/open?id=1TS8oSbZU7V2QtFfrNLK9S4DF7RgUv7bC
2022-10-28T13:41:57.000Z,10/27/2022,"Duolingo. Белгородчанин, ты опять пропустил урок украинского. Ты знаешь, что теперь будет!",https://vk.com/lentach?z=photo-29534144_458661458%2Fwall-29534144_19352516,"Duolingo. Belgorod citizen, you missed the Ukrainian lesson again. You know what will happen now!",War progress / outcome (general),"Ukraine, Russia",Russian,Screenshot,,DmLj108NNfQ,https://drive.google.com/open?id=1d5Nh-Ys3DILGdLijbQqDvRjflQw-4fao
2022-10-28T13:44:48.000Z,10/28/2022,"Зря смеётесь, профессор, мои потомки ещё этой страной руководить будут...",https://vk.com/lentach?z=photo-29534144_458660988%2Fwall-29534144_19347658,"You shouldn't laugh, professor, my descendants will lead this country ...",Russia (general),Russia,Russian,"Heart of a Dog (a Soviet film), News photo",Medvedev,yKR_9qmbGTs,https://drive.google.com/open?id=1dxUPP52jIdlb-02a8r6yaOHhx1RelcIG
2022-10-28T13:48:08.000Z,10/27/2022,Он празднует свои 70 лет -- они не отпразднуют и 20,https://vk.com/lentach?z=photo-29534144_458661033%2Fwall-29534144_19348091,He's celebrating his 70th birthday - they won't celebrate their 20th,"Mobilization / military draft / recruitment in Russia  , Russian troops (general)",Russia,Russian,News photo,Putin,LJ1PAkogCwo,https://drive.google.com/open?id=1Oom4k_VdTMjVYBpqvnMQjgc729LpxMef
2022-10-28T13:55:50.000Z,10/28/2022,Боже мой! Какой у Владимира Владимировича прекрасный анус!,https://vk.com/lentach?z=photo-29534144_458662244%2Fwall-29534144_19360300,My God! What a beautiful anus Vladimir Vladimirovich has!,Putin (general),Russia,Russian,Demotivator,"Putin, Mikhalkov (Nikita)",raPCJCNXYAE,https://drive.google.com/open?id=1GhcTmLSkXcpH6Pp6FxAw3XtJkaOm7SiF
2022-10-28T14:00:01.000Z,10/28/2022,"200 тысяч единиц уже готовы, еще миллион на подходе",https://vk.com/lentach?z=photo-29534144_458662179%2Fwall-29534144_19359767,"200 thousand units are ready, another million are on the way",Mobilization / military draft / recruitment in Russia,Russia,Russian,Star Wars,,uxpEh35a7qM,https://drive.google.com/open?id=1-cQ22GrxSr4o-VVGzZJAQESTcP5ZGJGU
2022-10-28T14:02:33.000Z,10/28/2022,"300 тыщ готовы, еще 25 лямов на подходе",https://vk.com/lentach?z=photo-29534144_458662269%2Fwall-29534144_19360471,"300  thousands are ready, 25 millions are on the way",Mobilization / military draft / recruitment in Russia,Russia,Russian,"News photo, Star Wars","Putin, Medvedev, Shoigu",5byT0ZlGexM,https://drive.google.com/open?id=1YxGSFlLj6AKzTkX0V39L25A1OyqNPPQR
2022-10-28T14:07:32.000Z,10/28/2022,"- Мужики, я почти умер, чего надо? - Тебе повестка",https://vk.com/lentach?z=photo-29534144_458662203%2Fwall-29534144_19359943,"- Guys, I almost died, what do you need? - you have a military subpoena",Mobilization / military draft / recruitment in Russia,Russia,Russian,Artwork,,jjhgPGZ4FxU,https://drive.google.com/open?id=1mLOrIj730AUJlYagQKz0rI1S7d4CQEVb
2022-10-28T14:11:52.000Z,10/28/2022,"300 000 уже готовы, 143 000 000 на подходе",https://vk.com/lentach?z=photo-29534144_458662240%2Fwall-29534144_19360271,"300,000 are ready, 143,000,000 are on the way",Mobilization / military draft / recruitment in Russia,Russia,Russian,Star Wars,,EWsjM2DzhyI,https://drive.google.com/open?id=14lvsTb_CQva_VbJ4gl2N0x3wsyUsNKp7
2022-10-30T10:32:56.000Z,10/28/2022,Спектакль окончен. Кремлевское леБ*ЯДИНОЕ озеро. Умирающий леБ*ЯДЬ.,https://www.facebook.com/photo.php?fbid=1279844885893162&set=p.1279844885893162&type=3,The show is over. Kremlin's F*CKing Swan Lake. The F*KING Dying Swan.,"End of the Putin regime, Putin (general)",Russia,Russian,Performer photo,Putin,312061640_1279844882559829_6409964032151641011_n,https://drive.google.com/open?id=1TD0eX9FadPIQHr8bbKG2BgAX-f0rYNh1
2022-10-30T10:57:44.000Z,10/29/2022,"[Shoigu, Lavrov, ? and Medvedev perform Dance of the Little Swans (a symbol of the end of the regime)]",https://www.facebook.com/photo.php?fbid=1272217283630936&set=p.1272217283630936&type=3,,"Dance of the Little Swans, End of the Putin regime",Russia,n/a,Stock photo,"Putin, Lavrov, Medvedev, Shoigu",313073770_1272217280297603_9046352326412511019_n,https://drive.google.com/open?id=17WYvftBNAVDcyKUp4WYa-puBRSJNke9x
2022-10-30T11:31:13.000Z,10/29/2022,Мечты сбываются...,https://www.facebook.com/photo.php?fbid=4829875057115616&set=p.4829875057115616&type=3,Dream do come true...,"Mobilization / military draft / recruitment in Russia  , Russian propaganda and state media",Russia,Russian,News photo,,311992076_4829875027115619_4016268579664420637_n,https://drive.google.com/open?id=1cy_VstH95ntLO1CbK7UU61zdZMiehwm1
2022-10-30T11:35:26.000Z,10/27/2022,"Через 40 лет Россия могла бы оказаться в полной ж*пе, если бы не Путин - он нашел туда короткий путь",https://www.facebook.com/photo.php?fbid=1437778540065893&set=p.1437778540065893&type=3,"In 40 years, Russia could be in complete shit if not for Putin - he found a shortcut there","Putin (general), Russia (general)",Russia,Russian,News photo,Putin,313313169_1437778533399227_1674913211498478408_n,https://drive.google.com/open?id=1j4UBMfTEolQp32-HwGqzhqKB4-ZI2isP
2022-10-30T11:38:43.000Z,10/27/2022,Путин оттягивает свой конец,https://www.facebook.com/photo.php?fbid=1760663540976982&set=p.1760663540976982&type=3,Putin is delaying / pulling his end,"End of the Putin regime, Putin (general)",Russia,Russian,News photo,Putin,311979767_1760663537643649_5902988450662796668_n,https://drive.google.com/open?id=1fnKEqnzZAtpIzydsdYKsUeAC99UqxfCA
2022-10-30T11:43:25.000Z,10/27/2022,[Putin at a cemetery filled with fresh graves],https://www.facebook.com/photo.php?fbid=1341664996661125&set=p.1341664996661125&type=3,,"Putin (general), War progress / outcome (general)",Russia,Russian,"News photo, Putin sitting oddly",Putin,312869561_1341664993327792_7739911092457643000_n,https://drive.google.com/open?id=1ORK3ntnPLWXX5hKy9kWjv5mniEG5ySaH
2022-10-31T00:47:28.000Z,,The Tank Abandooner [sic],https://knowyourmeme.com/search?context=images&page=10&q=Ukraine,,Russian troops (general),Russia,English,Rage comics,,The_Tank_Abandooner_Sucho_Memes,https://drive.google.com/open?id=1Je0zSpUCZRJD3I4M67_l3aZmLVfNX50n
