Timestamp,Date Posted,Title,Source Url,Translated Title,Meme Content Type,Country,Language,Meme Template Type,People,Original Filename,Google Drive Link
2022-04-24T21:23:18.000Z,3/11/2022,Чуй Гаррі. Можеш шото сказать по-зміїному? Канєшно можу «Рускій воєнний корабль іді нахуй!!»,https://focus.ua/voennye-novosti/508998-ukraincy-sozdayut-memy-o-vojne,"Listen, Harry. Can you say something in snake? Of course I can: ""Russian battleship, go fuck yourself!""",Russian warship,"Ukraine, Russia",Ukrainian,"Harry Potter, Film (non-Soviet)",,hp_battleship.jpeg,https://drive.google.com/open?id=1EYEmzERahKofNlavBwQjAu3fgeIXZSWa
2022-04-24T22:07:45.000Z,4/13/2022,"Українці, коли пан Президент знов закуколдив якогось євролідера 🥰🙏✨",https://t.me/istukrmemes/5167,"Ukrainians, when Mr. President once again pokes at a European leader.","Zelensky (general), Ukraine (general)","Ukraine, Europe",Ukrainian,Stock photo,,poke_euroleader.png,https://drive.google.com/open?id=14R7sZs_iPUXZQ60uANtF4XCrB8wRlSDk
2022-04-25T07:26:33.000Z,4/14/2022,Operation Z / Operation Ctrl+Z,https://twitter.com/uamemesforces/status/1514512200022560769,Operation Z / Operation Ctrl+Z,Russian warship,"Ukraine, Russia",English,Stock photo,,ctrlz.jpeg,https://drive.google.com/open?id=1Em1c1TqVCpxQzwjevciuy-W18eAnzVXl
2022-04-25T14:33:28.000Z,4/25/2022,Elon Musk should've bought RT instead and shut it down,https://twitter.com/TonyMasiuk/status/1518700937602236418,,Russian propaganda and state media,Russia,English,News photo,Musk (Elon),musk_rt.jpeg,https://drive.google.com/open?id=1EZDCqLkTrMDGLUZUb1pauzMT_gPqvHQn
2022-04-26T13:35:30.000Z,4/8/2022,[Lukashenko explains to Putin where the attack on Belarus was being planned from],https://t.me/hahaby/3622,,And I am now going to show you,"Ukraine, Russia, Belarus",n/a,News photo,"Lukashenko, Putin",photo_2022-04-26_16-30-13,https://drive.google.com/open?id=1GCJznYXtP5CG6fGXnvU10n-ZjeLdJnQi
2022-04-26T15:50:57.000Z,4/27/2022,"- Hey Vova, wanna hear a joke? - Go ahead - Kyiv - ...I don't get it - That's right, bitch, you don't",https://twitter.com/Cristinamarie62/status/1519054693061873674,,"War progress / outcome (general), Zelensky (general), Putin (general)","Ukraine, Russia",English,News photo,"Zelensky, Putin",FRTEMWKXEAEKO6d.jpg,https://drive.google.com/open?id=1wOjWAv0IveWTUjRgyhk0xK25g0dt9F0w
2022-04-26T17:56:27.000Z,3/10/2022,"Ти з Месників? - Ні, я з Укрпошти",https://www.aljazeera.com/news/2022/3/10/ukrainian-wartime-humour-derides-and-ridicules-russia,"Are you one of the Avengers? - No, I am from the Ukraine Post","Ukrainian troops (general), Ukraine's heros (individual)",Ukraine,Ukrainian,Film (non-Soviet),,Are-you-one-of-the-Avengers-No-I-am-from-Ukrainian-Mail,https://drive.google.com/open?id=1yKfCFwiBzxYBC78_fwJENctLiAPdpOT6
2022-04-26T17:57:00.000Z,4/23/2022,Zалупа,https://t.me/pr_russia/35803?comment=1988824,Dickhead,Z and/or V,Russia,Russian,Text only,,photo_2022-04-26_20-54-22,https://drive.google.com/open?id=1Vu2I8FqeJR33SBMQPHletyPbiY2_CR1B
2022-04-26T17:59:06.000Z,4/22/2022,Завтрак червей,https://t.me/pr_russia/35800?comment=1985445,Worms' breakfast,"Z and/or V, Russian troops (general)","Ukraine, Russia",Russian,Cartoon,,photo_2022-04-26_20-57-27,https://drive.google.com/open?id=1VqWZcNhqF6k7ooVsXqPoU0m6-z2UdTEj
2022-04-26T18:02:11.000Z,,"Should I tell him to f...k himself? Just in case (turns up volume) Russian warship, go f...k yourself!",https://www.boredpanda.com/ukraine-support-memes/?utm_source=google&utm_medium=organic&utm_campaign=organic,,Russian warship,"Ukraine, Russia",English,Animal photo,,Seagull Insults Warship,https://drive.google.com/open?id=1flkg6Q6Hb-6qCu47hgErreT9MQlL0iZ7
2022-04-26T18:12:40.000Z,3/10/2022,"НАТО пояснює Україні, чому не може закрити небо",https://www.aljazeera.com/news/2022/3/10/ukrainian-wartime-humour-derides-and-ridicules-russia,NATO explains to Ukraine why it cannot close the skies,"Lend-Lease and other military assistance to Ukraine, NATO (general)","Ukraine, NATO countries",Ukrainian,Mel Gibson Talking to Bloody Jesus,Jesus Christ,NATO-explans-no-fly-zone-to-Ukraine,https://drive.google.com/open?id=1cfEIDHR7Na_EXgiIltuZzTOxsQfGOiB6
2022-04-26T18:27:07.000Z,4/22/2022,"Как вы относитесь к войне в Гондоре? - Я поддерживаю нашего правителя Саурона. Если он так решил, значит, так нужно было.",https://t.me/pr_russia/35800?comment=1985402,"How do you feel about the war in Gondor? - I support our ruler Sauron. If he decided so, then it was necessary.","Russia (general), Obedient Russians","Ukraine, Russia",Russian,"Lord of the Rings (film), Film (non-Soviet)",,photo_2022-04-26_21-03-46,https://drive.google.com/open?id=1PdrpWCUvRPnAnlbqn9LViZxUmmragBRO
2022-04-26T18:32:17.000Z,4/22/2022,#Vзяли ZаЩеку,https://t.me/pr_russia/35796?comment=1985248,#They suck it,Z and/or V,Russia,Russian,Text only,,photo_2022-04-26_21-28-42,https://drive.google.com/open?id=1C9fg5EVg2GsIPLsvz2E0XcGBEM9_Al_I
2022-04-26T18:42:54.000Z,4/24/2022,"А я вам сейчас покажу, откуда готовилось нападение",https://vk.com/wall-29534144_17372501?z=photo-29534144_458496314%2Falbum-29534144_00%2Frev,And now I'll show you where the attack was planned from,And I am now going to show you,"Ukraine, Belarus",Russian,Film (Soviet),Lukashenko,sOO0jG-2ghsUQ76oIBGU_otV7T9_1bOCYgIPCBHWY1CMHIvTyx-tL9ElUnhHlSsmWyHI5T4imdLscNBOghG-HEFO,https://drive.google.com/open?id=1_Uz_C_4ZSpbkTXzXuVgGfmUwJyNn-KSd
2022-04-26T19:02:58.000Z,4/19/2022,"Масква? Вы думаете вы в Маскве? ""Ирония судьбы или опять в Чернобаевке""",https://t.me/luxta_tv/4515?comment=518140,"Moscow? You think you are in Moscow? ""Irony of Fate, or, back to Chernobaevka""",Chornobaivka,"Ukraine, Russia",Russian,Film (Soviet),,photo_2022-04-26_21-52-49,https://drive.google.com/open?id=1zxljAlTJxqahonzSHB0AR5NgRBEH5-ls
2022-04-26T19:07:14.000Z,2/28/2022,Ожидание - Реальность,https://euroradio.fm/ru/vmesto-koncerta-gazmanova-na-koncert-k-kobzonu-chem-obernulas-voyna-dlya-rf,Expectation - Reality,Kobzon's concert,"Ukraine, Russia",Russian,Infographics,Kobzon,imagepng28860d1531daf65b0e83a10725e7bfa2,https://drive.google.com/open?id=15_mK4BHW2mvAcEmcVCjYQF3CXHOcV_p_
2022-04-26T19:10:54.000Z,4/19/2022,"Русский солдат! Жду тебя на своих концертах! Гостомель, Харьков, Сумы, Щастье, Мариуполь, Каховка и другие города Украины.",https://t.me/luxtavik/518285,"Russian soldier! I'm waiting for you at my concerts! Gostomel, Kharkiv, Sumy, Shchastya, Mariupol, Kakhovka and other cities in Ukraine.",Kobzon's concert,"Ukraine, Russia",Russian,"Performer photo, Poster",Kobzon,sticker,https://drive.google.com/open?id=1rsGVzzT1CWvJp8lhomPsayecSMo8Glv6
2022-04-27T07:40:29.000Z,4/1/2022,Паляница : не можем повторить,https://thegard.city/articles/203876/1-kvitnya-memi-pro-vijnu,Palianytsia : we can't repeat it,"""Palianytsia"" (a shibboleth for Ukrainian language)","Ukraine, Russia","Ukrainian, Russian",Stock photo,,o_1fvin2sntc0n1s9c6bk1lum6ld6g,https://drive.google.com/open?id=1tXawjdcmCkjCwPZpD0WKU9r4T1bJBUNN
2022-04-27T07:43:48.000Z,4/1/2022,Chornobaïvka,https://thegard.city/articles/203876/1-kvitnya-memi-pro-vijnu,Chornobaivka,Chornobaivka,"Ukraine, Russia",Ukrainian,Map,,o_1fvimv1rejsj1f1i15q7lhnc7r3g,https://drive.google.com/open?id=1DdDap16ra7yaoCDnJGnX06ex-4kO7-O4
2022-04-27T07:45:57.000Z,4/1/2022,Чорнобаївка,https://thegard.city/articles/203876/1-kvitnya-memi-pro-vijnu,Chornobaïvka,Chornobaivka,"Ukraine, Russia",Ukrainian,Stock photo,,o_1fvimv1rfgsv1c467f4mra18bq3h,https://drive.google.com/open?id=1z1K6zC6Oodn2U5ckoaHSmgdcZvtazHaE
2022-04-27T11:30:33.000Z,4/1/2022,"Що, знову? -Чорнобаївка? -Чорнобаївка. -Йой, най буде.",https://thegard.city/articles/203876/1-kvitnya-memi-pro-vijnu,"What, again? -Chornobaïvka? -Chornobaïvka. -Well, let it be.",Chornobaivka,"Ukraine, Russia",Ukrainian,"And what about goblets?, Animal photo",,o_1fvimv1rfbrs1h41vfi16s05gb3k,https://drive.google.com/open?id=1NCIiEJp_TEsHQjrAY3WGKNZ0frVpTLN8
2022-04-27T11:39:04.000Z,4/1/2022,"Украïна, липень 2022",https://thegard.city/articles/203876/1-kvitnya-memi-pro-vijnu,"Ukraine, July 2022","Sunflowers on graves / sunseeds in pockets, Chornobaivka, War progress / outcome (general)",Ukraine,Ukrainian,Stock photo,,o_1fvimvvqe1fgjqa2aekbr3a124t,https://drive.google.com/open?id=1se8HnTG7ONoDLVLwlpcrUFjov8wgglJd
2022-04-27T11:41:15.000Z,4/1/2022,Чорнобаївка,https://thegard.city/articles/203876/1-kvitnya-memi-pro-vijnu,Chornobaïvka,Chornobaivka,"Ukraine, Russia",Ukrainian,Cartoon,,o_1fvimvvqemr1jk33jn13cg1u5u4u,https://drive.google.com/open?id=1eaSncXQn3vO_aX-QczqDKnTcY7R2-VRT
2022-04-27T11:46:34.000Z,4/1/2022,"In Ukraine we don't say ""De javu"" we say ""Chornobayivka"" and I think thats beautiful",https://thegard.city/articles/203876/1-kvitnya-memi-pro-vijnu,,Chornobaivka,"Ukraine, Russia",English,Performer photo,,o_1fvin77of12qdusqogeme21alm1r,https://drive.google.com/open?id=1vQm4qKvI4zoZTQVObPUXb8k27luhRotc
2022-04-27T11:56:13.000Z,3/2/2022,Коли вкрав вже 10й танк. Циган привид.,https://www.facebook.com/ukwcg/photos/1028615101060359,When you've stolen your 10th tank. Gypsy ghost.,"Tank stealing / capturing, Civilian resistance in Ukraine","Ukraine, Russia",Ukrainian,War photo,,275106922_1028615097727026_6147692044577369511_n,https://drive.google.com/open?id=1URwd1alD49dKZrddIZRcZed6eJJyMebh
2022-04-27T12:12:21.000Z,4/1/2022,ЗНО з iсторїi Україны 2050,https://thegard.city/articles/203876/1-kvitnya-memi-pro-vijnu,External Independent Examination in Ukraine History 2050,"Tank stealing / capturing, Civilian resistance in Ukraine",Ukraine,Ukrainian,Cartoon,,o_1fvim7do8mvvna418gb1lc4upq47,https://drive.google.com/open?id=1Mcr6o1hp0lrHSqNMJIShjqLvuxGXwV3s
2022-04-27T12:15:21.000Z,4/1/2022,Спалили ще одну колону кацапiв,https://thegard.city/articles/203876/1-kvitnya-memi-pro-vijnu,We have burned another column of Russians,Ukrainian troops (general),"Ukraine, Russia",Ukrainian,And what about goblets?,Zaluzhnyǐ (Valeriǐ),o_1fvim4sq31d5qqhd1urn1649rak3o,https://drive.google.com/open?id=1i9l1IIMVh94H7IUo8vLGG79KOCBvtbnG
2022-04-27T12:26:22.000Z,4/1/2022,Нiколи не питайте...,https://thegard.city/articles/203876/1-kvitnya-memi-pro-vijnu,Never ask...,"Tank stealing / capturing, Civilian resistance in Ukraine",Ukraine,Ukrainian,Cartoon,,o_1fvilu2lgjdg1r471brc1l9sd581t,https://drive.google.com/open?id=11Sb8nu_E_ucTafLtgdUofg-ozbQCoenz
2022-04-27T13:56:03.000Z,4/22/2022,"А я сейчас вам покажу, откуда на Изенгард готовилось нападение",http://arda.reactor.cc/post/5173034#comment25420638,And I am now going to show you where they planned to attack Isengard from,And I am now going to show you,"Ukraine, Belarus",Russian,"Lord of the Rings (film), Film (non-Soviet)",Lukashenko,А-я-сейчас-вам-покажу-политика-лукашенко-Арда-other-4534369 (1),https://drive.google.com/open?id=11VPgvgaYaK48bYc29Es5YzAQX1kPL8tu
2022-04-28T14:42:12.000Z,4/21/2022,Nazi,https://t.me/luxtavik/518817,,Z and/or V,Russia,English,Text only,,photo_2022-04-28_17-40-15,https://drive.google.com/open?id=1IqfiH2xa2H0-eNXChw67CaiaMOjUoeL0
2022-04-28T14:48:00.000Z,2/11/2022,Welcome 2022,https://www.moscowtimes.ru/2022/02/11/dlinnii-stol-a17418,,Putin keeping his distance,Russia,n/a,The long table,"Putin, Macron",64ck82,https://drive.google.com/open?id=1H8FVPWJoGtWPTnoqEZNF9QeP6iD9U2uO
2022-04-28T14:50:09.000Z,2/11/2022,"[Ballerina A. Volochkova performs a split on Putin's long table, with Putin and Macron sitting on the ends]",https://www.moscowtimes.ru/2022/02/11/dlinnii-stol-a17418,,Putin keeping his distance,Russia,Russian,The long table,"Putin, Macron, Volochkova",273111261_10221573158335331_1358354474975609062_n,https://drive.google.com/open?id=13atUobtXX9NzmLE8UHpYLsFAKR_TgIjy
2022-04-28T14:50:55.000Z,2/11/2022,"[Kadyrov dances on Putin's long table, with Putin and Macron sitting on the ends]",https://www.moscowtimes.ru/2022/02/11/dlinnii-stol-a17418,,Putin keeping his distance,Russia,n/a,The long table,"Putin, Macron, Kadyrov",273478463_5142133735849995_5732255031977832627_n,https://drive.google.com/open?id=1p-0s6332jo5Do_upZalCK0VPWSo5bUyQ
2022-04-28T14:51:45.000Z,2/11/2022,[Macron shows Putin an eye chart from another end of the long table],https://www.moscowtimes.ru/2022/02/11/dlinnii-stol-a17418,,Putin keeping his distance,Russia,n/a,The long table,"Putin, Macron",FLBkkgbXMAUtiZO,https://drive.google.com/open?id=1fXBzU1X-ET7QGfcpVqKUIh7B9jzHoHsh
2022-04-28T14:53:01.000Z,2/11/2022,[Putin and Macron play table tennis on the long table],https://www.moscowtimes.ru/2022/02/11/dlinnii-stol-a17418,,Putin keeping his distance,Russia,n/a,The long table,"Putin, Macron",FLEJQjRXoAQCLJe,https://drive.google.com/open?id=19xv293EyS1wbLiRN4Dh5WG0q9F7tD38u
2022-04-28T14:53:45.000Z,2/11/2022,"[A pair of figure skaters use the long table as a skating ring, whicle Putin and Macron sit at the ends]",https://www.moscowtimes.ru/2022/02/11/dlinnii-stol-a17418,,Putin keeping his distance,Russia,n/a,The long table,"Putin, Macron",FLEJQjVWQAAc3H1-2,https://drive.google.com/open?id=1fjZKoBMNa6jnLlk4_g31PonU8fKrZcMD
2022-04-28T14:54:31.000Z,2/11/2022,"[Putin and Macron sit at the ends of the long table, while Bernie Sanders in mittens takes a nap]",https://www.moscowtimes.ru/2022/02/11/dlinnii-stol-a17418,,Putin keeping his distance,Russia,n/a,The long table,"Putin, Macron, Sanders (Bernie)",FLEJQj-XwAAtiNa,https://drive.google.com/open?id=1Cu2x2nQjrMT77GuPz89ouRlYjtoheH72
2022-04-28T14:55:25.000Z,2/11/2022,[Putin and Macron sit at the ends of an extremely long table],https://www.moscowtimes.ru/2022/02/11/dlinnii-stol-a17418,,Putin keeping his distance,Russia,n/a,The long table,"Putin, Macron",image-2,https://drive.google.com/open?id=1lCgtaf6kY99LS08X-KqJmI-hPI9kKm-9
2022-04-28T15:06:41.000Z,2/26/2022,Звичайна українська бродяча собака через тиждень,https://t.me/hahaby/3547,An ordinary Ukrainian stray dog a week later,Ukrainian dogs/foxes/etc. getting fatter (for eating corpses of enemies),"Ukraine, Russia",Ukrainian,Demotivator,,photo_2022-04-28_18-01-31,https://drive.google.com/open?id=11UJv7TV_-Rdy-g9z6J9_NUILcO5x19Vg
2022-04-28T15:13:27.000Z,2/28/2022,"Ванек, вставай, уходи [...]",https://t.me/hahaby/3558,"Vanya, get up and leave [...]","Russian troops (general), Ukrainian troops (general)",Ukraine,Russian,Get up Natasha!,,photo_2022-04-28_18-07-23,https://drive.google.com/open?id=1kcmj5TCobcp636OzlDCDaYy05uClFLCY
2022-04-28T15:24:02.000Z,2/5/2022,Никто не сломит дух русской армии потому что у русской армии нет духа,https://t.me/hahaby/3576,No one will break the spirit of the Russian army because the Russian army has no spirit,Russian troops (general),Russia,Russian,Roll Safe,,photo_2022-04-28_18-22-07,https://drive.google.com/open?id=1JCPSkrli-vyYlyAFstp-5PSbOChiCjn3
2022-04-28T15:30:04.000Z,3/17/2022,Ми будемо захищати Україну до останньої краплі крові ...],https://t.me/hahaby/3586,We will defend Ukraine until the last drop of blood [...],"Russian troops (general), Ukrainian troops (general)","Ukraine, Russia","Ukrainian, Russian",Rage comics,,photo_2022-04-28_18-26-43,https://drive.google.com/open?id=1XMvALP_QhI33uwpv6XPdiYTLOWwZDupv
2022-04-28T15:38:27.000Z,3/15/2022,"Украінскія нацыяналісты, жыдабандераўцы, нацысты, фашысты і іншыя [...]",https://t.me/hahaby/3584?comment=32225,"Ukrainian nationalists, Jewish Bandera activists, Nazis, fascists and others [...]","Russian troops (general), Ukrainian troops (general)","Ukraine, Russia","Russian, Belarusian",Buff Doge vs. Cheems,,photo_2022-04-28_18-31-16,https://drive.google.com/open?id=1X5s8GvdCaUxN6p0_BLHm-CbjxE7WnBbB
2022-04-28T15:44:38.000Z,2/25/2022,День 1: Возьмем Украину блицкригом [...],https://t.me/hahaby/3542,Day 1: Let's take Ukraine by blitzkrieg [...],Russian troops (general),"Ukraine, Russia",Russian,Buff Doge vs. Cheems,,photo_2022-04-28_18-41-25,https://drive.google.com/open?id=1g-1zgj__pmK-GE9xMyWvK4K6XqV5jIi9
2022-04-28T15:51:39.000Z,4/5/2022,How to catch a Russian soldier,https://t.me/hahaby/3616,,Marauding,"Ukraine, Russia",English,Stock photo,,photo_2022-04-28_18-48-09,https://drive.google.com/open?id=14O7sVUNBipuYOPR08K_7XIuAxmdOLCB0
2022-04-28T15:58:08.000Z,4/21/2022,Ukraine - Easter European countries - Ukraine's application for EU candidate status - Western European countries,https://t.me/luxta_tv/4524?comment=519004,,Marauding,"Ukraine, Russia",n/a,Artwork,,photo_2022-04-28_18-52-21,https://drive.google.com/open?id=1CfgtRgR28AYcUVRuVC9m5V_wzrz1KWu4
2022-04-28T16:01:01.000Z,4/21/2022,Деды воровали: 03-2022,https://t.me/luxta_tv/4521?comment=518752,Our grandfathers were stealing: 03-2022,Marauding,"Ukraine, Russia",Russian,Artwork,,photo_2022-04-28_18-58-49,https://drive.google.com/open?id=1F9PVJrmuv2kRpQDc4Bw3u8FTWem8o57p
2022-04-28T16:13:11.000Z,,The artist Maksym Palenko also copes well with this:,https://it-kharkiv.com/gumor-pid-chas-vijny-yak-ne-zijty-z-rozumu-vid-strichky-novyn/,,Russian troops (general),"Ukraine, Russia",Ukrainian,Book cover / illustration,,The artist Maksym Palenko also copes well with this,https://drive.google.com/open?id=1bZzFpDRhBALjyS9k5cFsciO1i9ScmSfr
2022-04-28T16:14:05.000Z,2/24/2022,Я не хуйло,https://t.me/hahaby/3534?comment=31587,I am not a dickhead,Putin (general),Russia,Russian,Demotivator,Putin,photo_2022-04-28_19-03-27,https://drive.google.com/open?id=1r54dD-YMGMuBd4lByXLAOqEfeGPsfRIQ
2022-04-28T16:16:18.000Z,4/23/2022,"[Putin and Shoigu talking, Vitalyi Kim talking on the phone in the background]",https://t.me/luxta_tv/4530,,"Putin (general), Ukraine's heros (individual)","Ukraine, Russia",n/a,Putin sitting oddly,"Putin, Shoigu, Kim (Vitalyi)",photo_2022-04-28_19-15-02,https://drive.google.com/open?id=1kMwPE0wezooyMxeIFvlBTqCrZ3FBPVAI
2022-04-28T16:22:02.000Z,4/21/2022,Как идёт модернизация армии? [...],https://t.me/luxta_tv/4522?comment=518764,How is that modernization of the army?,"Putin (general), Russian troops (general)",Russia,Russian,News photo,"Putin, Shoigu",photo_2022-04-28_19-18-00,https://drive.google.com/open?id=1eX6hgeLsFeRip9ddo7sxUuvB-b-z1fvx
2022-04-28T16:29:29.000Z,4/21/2022,Моя прелесть,https://t.me/luxta_tv/4523?comment=518870,My precious,Putin (general),"Ukraine, Russia",Russian,"Lord of the Rings (film), Film (non-Soviet)",Putin,photo_2022-04-28_19-24-57,https://drive.google.com/open?id=1o7x3byknBe3Uq3ySxJ3NaUDUNXI_AFrx
2022-04-28T16:40:22.000Z,4/28/2022,К Параду ГотоVы,https://t.me/oldlentach/62093?comment=1780820,Ready for the Parade,"Marauding, Russian troops (general)",Russia,Russian,Stock photo,,photo_2022-04-28_19-38-42,https://drive.google.com/open?id=1hgztlCJWM-t_-6NvsCFV_yi2XsBzVs-n
2022-04-28T16:45:04.000Z,4/28/2022,"[Putin, members of Russian government and media leaders as members of Nazi leadership at the Nuremberg trial]",https://t.me/oldlentach/62091?comment=1780684,,"End of the Putin regime, War progress / outcome (general)",Russia,n/a,Historical photo,"Putin, Medvedev, Kirill of Moscow (Gundiaev), Kiselev (Dmitrii)",photo_2022-04-28_19-43-03,https://drive.google.com/open?id=1BRs0xS2V5eGc3V0h8bi6UBwiJ_Feo5Sh
2022-04-28T16:48:24.000Z,4/28/2022,"Дайте мне один десантно-парашютный полк, и через 3 часа его не будет. Шойгу С. К.",https://t.me/oldlentach/62091?comment=1780717,"Give me one airborne regiment, and in 3 hours it will be gone. S. K. Shoigu",Russian troops (general),Russia,Russian,News photo,Shoigu,photo_2022-04-28_19-45-56,https://drive.google.com/open?id=1BESV3zU74ZRZfzdAIgaC2TuFRQ345AaL
2022-04-28T17:06:11.000Z,4/20/2022,You are our largest arms supplier,https://twitter.com/LeonEoW/status/1519384197613428739/photo/1,,"Russia (general), Ukraine (general)","Ukraine, Russia",English,TV show,,FRXv0CEWUAIGY9O.jpg,https://drive.google.com/open?id=1CAdaJbZZAnD7Zi-phj52dJGKSXxB4Fzh
2022-04-28T17:09:31.000Z,4/24/2022,I will use nuclear weapons,https://twitter.com/MENAConflicted/status/1519774664628834304,,"Russia (general), War progress / outcome (general)","Ukraine, Russia, NATO countries",English,Cartoon,,FRdTAOWWYAAJwMd.jpg,https://drive.google.com/open?id=136zjkcw0GmGU3TUwXwe0jfwEU6WdG4wm
2022-04-30T07:33:17.000Z,4/29/2022,"-Ну как вы там, потомки?",https://www.facebook.com/100000792119147/posts/5161977273838625/,"-So how are you doing there, descendants?","Russia (general), Ukraine (general)",Russia,Russian,Historical photo,Gagarin (Iurii),GcyZUeRUWrGEBzqUtie1ele8WV0VEyJz0Qkax-DcPzwYszCV9ba_boMjtgX3MUJiF3Tuwm7Mt4dInt_y-TxgaxCn,https://drive.google.com/open?id=1OgAAG7J1uyIOOIFU8FxoMYJ6YnvK9xJj
2022-04-30T07:41:39.000Z,4/29/2022,Мишки haribo ушли из России? Прекращайте спецоперацию,https://vk.com/lentach?z=photo-29534144_458500727%2Fwall-29534144_17422752,Have haribo bears left Russia? Stop the special operation,Sanctions and import substitution,Russia,Russian,News photo,Bogdanoff (Igor),VxiPZKLs3uZJsof99sic434m2E5Wd5AYRXBZTlijgWx2iGEXpwzmNFapJzYzswzma_0C0h3mRC0efQds0hyy6P-v,https://drive.google.com/open?id=1JG-KuQ6J7DD8YVzDWbOIa0om4rd_FhVc
2022-04-30T08:01:51.000Z,4/29/2022,Страна иноагентов,https://vk.com/lentach?z=photo-29534144_458500340%2Fwall-29534144_17418153,The country of foreign agents,"Russia (general), Russian opposition",Russia,Russian,Map,,I-SKKvqp2c9KzzZLnJvJQLJjfTHBqo4UoksIQyMlYG4SaGEp5f9pg_cQLdStz6bycB5sYYGE3yTdXveHg-yOoF-q,https://drive.google.com/open?id=1wb-QAapwoanSnV9xYdS1ViACMCqUElgE
2022-04-30T08:07:15.000Z,4/29/2022,"Да ты пойми, Америка хочет захватить наши ресурсы.",https://vk.com/lentach?z=photo-29534144_458500480%2Fwall-29534144_17419636,"Try to understand, America wants to seize our resources.",Russia (general),Russia,Russian,News photo,,SrQKM_MDMwnZcPSQu9DXe09wNCRBxvP3_MtZuzoa80p9ypWePVjeSY99k1Byod1bkYBR1vl-OwXk1qAzt59U53kj,https://drive.google.com/open?id=1fqpTPduPjeSJIRnvCze-qv4VtijMwuvt
2022-04-30T08:09:35.000Z,4/29/2022,Слава Україні! [...],https://vk.com/lentach?z=photo-29534144_458500524%2Fwall-29534144_17420178,Glory to Ukraine! [...],Putin (general),"Ukraine, Russia",Ukrainian,News photo,Putin,JJ7z4khspdgN6id9NcO5LZi7qVxuhEnUddUiWtYN6lC6EhkzJSFK3PDX_QIkcxVOIlBxp8l2vY_5x8jcD_lgDcUG,https://drive.google.com/open?id=1iBmjPTYwOsqlbdvG0LoEKxaf8oo8dr3V
2022-04-30T08:17:22.000Z,4/28/2022,"Гиркин-Стрелков, когда увидел список",https://vk.com/lentach?z=photo-29534144_458500280%2Fwall-29534144_17417193,"Girkin-Strelkov, when he saw the list",Lend-Lease and other military assistance to Ukraine,"Ukraine, United States",Russian,Book cover / illustration,Girkin,vIoyQRhjwQ1UVvGXhEfYs0eDtSkHmUoPgzC0gs-BpliBKc6Rd6-nYhK5UJTGPf947BiuFSeBV4MCnbzS6V45RQxN,https://drive.google.com/open?id=1o7155QO1p_zKoVcsZx7Q8MFtQyV1y2GE
2022-04-30T08:19:15.000Z,4/28/2022,З днем ленд-лiзу,https://vk.com/lentach?z=photo-29534144_458500285%2Fwall-29534144_17417219,Happy Lend-Lease Day!,Lend-Lease and other military assistance to Ukraine,"Ukraine, United States",Ukrainian,Holiday card,,SoFpYNKjVC7SqpTA4IyIvb32V1-LrV0x4N1mLGZjPop9Rf2oTavQqgntkqdyyNLgP_bo25SbRf2zefZnsuSs3YJL,https://drive.google.com/open?id=17LRjV2GMKUAGo4sR6LaXgsZFB1I_o87I
2022-04-30T08:34:43.000Z,4/30/2022,"Санек, покажи откуда на меня готовилось нападение [...]",https://www.facebook.com/photo/?fbid=5081459371947260&set=g.744560186046977,"Sanek, show me where the attack on me was being planned [...]","And I am now going to show you, Russian propaganda and state media","Russia, Belarus",Russian,News photo,"Lukashenko, Solov'ev (Vladimir)",279006380_5081459338613930_8810615603135257980_n,https://drive.google.com/open?id=1ZQVhBWOIC5fVdofNRqEsumX1IefiMhNt
2022-04-30T08:36:58.000Z,4/25/2022,Подарки раздайте к Пасхе [...],https://www.facebook.com/photo?fbid=1021484295410969&set=g.744560186046977,Distribute the presents for Easter [...],Putin keeping his distance,Russia,Russian,Putin meets with Shoigu and Gerasimov,"Putin, Shoigu, Gerasimov (Valerii)",278902935_1021484288744303_2651163322184364947_n,https://drive.google.com/open?id=12_DGN6Dx5lJRwNFXcyNFwXzvhOOsLwAD
2022-04-30T08:40:24.000Z,4/19/2022,[The Kremlin on fire and sinking in a sea],https://www.facebook.com/photo/?fbid=1640545859634909&set=g.744560186046977,,Russian warship,"Ukraine, Russia",n/a,Cartoon,,278609588_1640545852968243_2594191941347805774_n,https://drive.google.com/open?id=1o345BTU0hKtOa2TTRoUbvJWBH2iDmcRC
2022-04-30T08:42:39.000Z,4/18/2022,Патриарх Кирилл - Zа спецоперацию!,https://www.facebook.com/photo/?fbid=5191328440928558&set=g.744560186046977,Patriarch Kirill is for the special operation!,Russia (general),Russia,Russian,News photo,Kirill of Moscow (Gundiaev),278625824_5191328434261892_8098822932068139226_n,https://drive.google.com/open?id=1pxlrygfl8T4T__c9ZTicucbHsyCmXMVG
