Timestamp,Date Posted,Title,Source Url,Translated Title,Meme Content Type,Country,Language,Meme Template Type,People,Original Filename,Google Drive Link
2022-07-22T18:15:36.000Z,3/8/2022,"Мала, аеропорт відбили! Бронюй авіа! Зі святом 8 Березня!",https://www.instagram.com/p/Ca0gl7agJPV/?igshid=YmMyMTA2M2Y%3D,"Babe, the airport was recaptured! Book a flight! Happy March 8th!",Civilian resistance in Ukraine,Ukraine,Ukrainian,Holiday card,Kim (Vitalyi),Kim March 8th,https://drive.google.com/open?id=1eb86VTJFsYzTqbFETLPyJ1uFa07GZf30
2022-07-22T18:21:53.000Z,5/14/2022,Вся Україна сьогодні о 22:00: Євробачення -- Фейгін та Арестовіч,https://www.instagram.com/p/CdjQ4hpNEL8/?igshid=YmMyMTA2M2Y%3D,All of Ukraine today at 10pm: Eurovision -- Feigin and Arestovich,"Ukraine (general), War news - dealing with them, Eurovision",Ukraine,Ukrainian,Two buttons,"Arestovich, Feigin",Eurovision or Arestovich,https://drive.google.com/open?id=1qYOwUSXLKMwhrDpoI7WBgXYURArkYYo_
2022-07-23T17:05:16.000Z,7/20/2022,Нелюди,https://www.facebook.com/photo.php?fbid=1401928960299603&set=p.1401928960299603&type=3&__cft__[0]=AZXNSRk4B6YxcrOzCEwyD2jtIo2KYf7KHY0U9SMDRD8LB0SbvIjdux2y5keYvcIaUqQjg1X3IEvg-ddPObclkh5woxvl_wLQIOqsUyCYupKZNIrAQpimVcTIAp67oIeuMXdDzzafePHv9aCmBLiwyVRqlJDB2vkYr_CEzbG2qaNY7NoNoVEIw3XxZXzApJsedp8&__tn__=R]-R,Inhuman [in colors of the Russian flag],"Russia (general), War progress / outcome (general)",Russia,Russian,Text only,,294973164_1401928953632937_4514648781539319931_n,https://drive.google.com/open?id=1Z6vWh9eV5mTaksVFeTdZMmJYEGt3e8H7
2022-07-23T17:09:55.000Z,7/19/2022,The face of RuZZia,https://scontent-bos5-1.xx.fbcdn.net/v/t39.30808-6/294537368_1366321417211606_7968224004981174008_n.jpg?_nc_cat=107&ccb=1-7&_nc_sid=dbeb18&_nc_ohc=wTACSORnDgcAX_9JlvF&_nc_ht=scontent-bos5-1.xx&oh=00_AT9G-ywI06J_nsSELx1yjaFgfH_ujO2uhe504z6KHKXvrw&oe=62E256B7,,"Russia (general), Z and/or V",Russia,English,Z-faced guy,,294537368_1366321417211606_7968224004981174008_n,https://drive.google.com/open?id=18ruIY0bkcIExAeWMT2y8nd2x0uswLSEx
2022-07-23T17:21:50.000Z,7/22/2022,"Не плачь, сынок. Я ещё нарожаю.",https://scontent-bos5-1.xx.fbcdn.net/v/t39.30808-6/295278329_1271292227031736_4192395401600849466_n.jpg?_nc_cat=108&ccb=1-7&_nc_sid=dbeb18&_nc_ohc=FqvIOowLccMAX_cqPLt&tn=Eu5v6FKTvZn3U2yp&_nc_ht=scontent-bos5-1.xx&oh=00_AT8XG-4G-Q0x9cN1kC-q6lcJRSlkVt1_ysCBuhHE2DyjKA&oe=62E1487A,"Stop crying, son. I will procreate again.",Russians not valuing lives of their soldiers,Russia,Russian,News photo,,295278329_1271292227031736_4192395401600849466_n,https://drive.google.com/open?id=1gA21tBCh2iltlvf8Vwu4nkbmCA2wsBhx
2022-07-23T17:25:38.000Z,7/23/2022,[Putin as a vicious pig],https://scontent-bos5-1.xx.fbcdn.net/v/t39.30808-6/295119262_1306161256888981_3735358085965313784_n.jpg?_nc_cat=108&ccb=1-7&_nc_sid=dbeb18&_nc_ohc=k3a7ZLNxClAAX94gdsR&_nc_ht=scontent-bos5-1.xx&oh=00_AT-RIBcydBqMtYy3U6hQprXpDwrpMQnC5D2DxOcl1BaMpQ&oe=62E0D49E,,Putin (general),Russia,n/a,News photo,Putin,295119262_1306161256888981_3735358085965313784_n,https://drive.google.com/open?id=1wBuV4lTon8VoY5xf9Ni7snyZxCGbHu6A
2022-07-23T17:32:45.000Z,7/21/2022,Поздравляю! У вас будет машина!,https://scontent-bos5-1.xx.fbcdn.net/v/t39.30808-6/295047607_5493742764022424_639547692786537466_n.jpg?_nc_cat=102&ccb=1-7&_nc_sid=dbeb18&_nc_ohc=F2YCxp9r2zAAX_GU4jw&_nc_ht=scontent-bos5-1.xx&oh=00_AT-TYCfut_vYculeJ44ugWku_jX_2GU22S7FDwkNcAsdWA&oe=62E0E387,Congratulations! You are having a car! [Parents of a fallen Russian soldier bought a car using the death compensation payment],"Russians not valuing lives of their soldiers, Car as compensation for a fallen son",Russia,Russian,Stock photo,,295047607_5493742764022424_639547692786537466_n,https://drive.google.com/open?id=16pEjs4nNlGDqGK3tDkmiS7Do6MVgc8AE
2022-07-23T17:39:26.000Z,7/22/2022,"В периоды войн: Тегеранские конференции ""большой тройки"" и ""малая одиночка""",https://scontent-iad3-1.xx.fbcdn.net/v/t39.30808-6/295020175_760129431697751_2870281869972956494_n.jpg?_nc_cat=102&ccb=1-7&_nc_sid=5cd70e&_nc_ohc=8VOZ8ySg8FUAX9TDUqR&_nc_ht=scontent-iad3-1.xx&oh=00_AT-t4NNceVQ-cu1oUEqzPzJtLPi9o_2GFnHlDlifAUQKig&oe=62E1E825,"In times of war: Tehran conferences of the ""big three"" and the ""small loner""","Putin (general), Putin keeping his distance","Russia, Iran",Russian,Historical photo,Putin,295020175_760129431697751_2870281869972956494_n,https://drive.google.com/open?id=18Ngd3r0TMbivwAZm7c9k3T_cCoUF6Tci
2022-07-23T17:59:37.000Z,7/21/2022,Россия. Сын погибает в Украине. Его семья: - Ааааавтомобиль!!!,https://scontent-iad3-1.xx.fbcdn.net/v/t39.30808-6/295086460_1227385218077312_1873239621244976542_n.jpg?_nc_cat=104&ccb=1-7&_nc_sid=5cd70e&_nc_ohc=PDYUuYR2F84AX8sGd2E&tn=Eu5v6FKTvZn3U2yp&_nc_ht=scontent-iad3-1.xx&oh=00_AT-itcbQMhpZQ_3tCZ7g0LrBqpKZfFPQ9GF-znpthsdXOQ&oe=62E0CA4F,Russia. The son dies in Ukraine. His family: - Aaaaautomobilel!!! [The host of the Russian Wheel of Fortune],"Russians not valuing lives of their soldiers, Russian troops (general), Car as compensation for a fallen son","Ukraine, Russia",Russian,TV show,,295086460_1227385218077312_1873239621244976542_n,https://drive.google.com/open?id=1-QfEIOa679x9Ep9dvGYJBUNxFx130uvk
2022-07-23T18:10:19.000Z,7/20/2022,"- Группенфюрер, фюрер заявил из бункера, что войну всерье Германия еще не начинала! - Да уж, старик совсем плох...",https://scontent-iad3-1.xx.fbcdn.net/v/t39.30808-6/294771973_1226520358163798_648165237460783266_n.jpg?_nc_cat=108&ccb=1-7&_nc_sid=5cd70e&_nc_ohc=mNJiXm-keq8AX-9nDWw&tn=Eu5v6FKTvZn3U2yp&_nc_ht=scontent-iad3-1.xx&oh=00_AT-DhzvlYq7VUjHOFQgv_9litR14tjUSCQfE5jDU5E2ITg&oe=62E19E1F,"- Gruppenführer, the Fuhrer said from the bunker that Germany has not really started the serious war yet! - Yes, the old man is really bad ...","Putin (general), War progress / outcome (general), We haven't really started anything yet","Ukraine, Russia, Germany",Russian,Film (Soviet),Putin,294771973_1226520358163798_648165237460783266_n,https://drive.google.com/open?id=1GwusLnQvLby3NjZMGpRquXqKZJlpkA9H
2022-07-23T18:16:06.000Z,7/22/2022,Не все так однозначно -- Не политик чтобы говорить -- 8 лет дамбили бабмас -- Ани бы сами напали,https://scontent-iad3-1.xx.fbcdn.net/v/t39.30808-6/295273039_1228481937967640_6483424374038401470_n.jpg?_nc_cat=107&ccb=1-7&_nc_sid=5cd70e&_nc_ohc=qzw1wXdOfm0AX9i8H-h&_nc_ht=scontent-iad3-1.xx&oh=00_AT_HydGpnHzRdP9cuYS9nQbGWB1KwqM2hHMdtwALVrS9fA&oe=62E1A937,"It's no so straightforward -- I am not a politician, what do I know -- for 8 years they were bombing Donbass [""donbing babmas""] -- They would have attacked us first","8 years, It's not so straightforward, Russian propaganda and state media","Ukraine, Russia",Russian,Stock photo,,295273039_1228481937967640_6483424374038401470_n,https://drive.google.com/open?id=1CvQOCn-qkoz18slxDxibwKI4esAlZ3jX
2022-07-23T18:19:30.000Z,7/22/2022,"Хмуриться не надо, мама, хмуриться не надо, папа. Для вас смерть моя - награда: ""Лада"". - Спасибо сыну за машину!",https://scontent-bos5-1.xx.fbcdn.net/v/t39.30808-6/294138641_582710679965740_2293176077544447691_n.jpg?_nc_cat=111&ccb=1-7&_nc_sid=5cd70e&_nc_ohc=TbylNXkPB7cAX8t7vNo&_nc_ht=scontent-bos5-1.xx&oh=00_AT8ag4D5u45emlcsd52tkAF8iBmCgZYyevDcJ_erN9lr4A&oe=62E1A724,"No need to frown, mom, no need to frown, dad. For you, my death is a reward: ""Lada"". - Thank you son for the car!","Russian troops (general), Russians not valuing lives of their soldiers, Car as compensation for a fallen son",Russia,Russian,Text only,,294138641_582710679965740_2293176077544447691_n,https://drive.google.com/open?id=1N7LNwgyjQw-IB2BCpLkvCrn4qwMPqzgW
2022-07-23T19:03:35.000Z,7/23/2022,Отдай - Не дам,https://sun6-20.userapi.com/impf/me4QvoxEGQeI6TOHmHk9k90V3DGEHxJR6LO7Qg/NaDTSut3HA0.jpg?size=757x517&quality=95&sign=0ab5379c7052d17d89049a0f1314ccc8&type=album,Give it to me - No way,Putin (general),Russia,Russian,Putin sitting oddly,Putin,NaDTSut3HA0,https://drive.google.com/open?id=1uPafa7oUnc5U4xb6KrQGDc4yDDX5iYYk
2022-07-23T19:16:35.000Z,7/20/2022,"St. Javelin, the protector of Ukraine",https://scontent-iad3-1.xx.fbcdn.net/v/t39.30808-6/295018938_5711826918829914_3664575784735258359_n.jpg?_nc_cat=105&ccb=1-7&_nc_sid=dbeb18&_nc_ohc=M67_VQ9Ur6wAX-4l-wj&_nc_ht=scontent-iad3-1.xx&oh=00_AT-wh9U2yfM08aFyN7HZDEEkRiz3eupXWbxRGqvH2ycJ_A&oe=62E22C34,,Lend-Lease and other military assistance to Ukraine,Ukraine,English,Cartoon,,295018938_5711826918829914_3664575784735258359_n,https://drive.google.com/open?id=1l-0ZnJDEKpxAUWf2GSC9EPDip0sk46G6
2022-07-23T19:20:41.000Z,7/14/0222,"Л.Н. Толстой. ""Спецоперация и госизмена""",https://sun6-23.userapi.com/impf/MrjPXYd52NFggQ8ehPh4AQ2I3WevbNq6zVeMMA/T9K2a-5GzJI.jpg?size=834x1180&quality=96&sign=d4963c1cd9a077c051c08e0ece9b2405&type=album,"L.N. Tolstoy. ""Special operation and state treason""","Russian propaganda and state media, ""Special military operation"" (not a war)","Ukraine, Russia",Russian,Book cover / illustration,,T9K2a-5GzJI,https://drive.google.com/open?id=1YdhtmcrDVlhRrGSb-HHjpsIwE9-G50Vm
2022-07-24T10:42:12.000Z,7/24/2022,"1 сентября 1929 года Гитлер назвал вторжение в Польшу ""полицейской акцией"". 24 февраля 2022 года Путин назвал вторжение в Украину ""специальной операцией"".",https://sun6-22.userapi.com/impf/TxazYRoKR_h5M44fxuZLylyvcVvv1KS2-9Pncg/2XwlqRhDEB4.jpg?size=1080x1052&quality=95&sign=b1bf5dfef03c613f9e9d389ae09c6042&type=album,"On September 1, 1929, Hitler called the invasion of Poland a ""police action"". On February 24, 2022, Putin called the invasion of Ukraine a ""special operation"".","Putin as Hitler, ""Special military operation"" (not a war), Z and/or V","Ukraine, Russia, Germany",Russian,Text only,"Putin, Hitler",2XwlqRhDEB4,https://drive.google.com/open?id=10MyksSyR63nUjkm9qc1zKHIMpHbYxkds
2022-07-24T10:47:09.000Z,7/24/2022,Zа Лупина!,https://sun6-21.userapi.com/impf/o_yd21itEhwAN_pVvHvAkzrZRuXfdOkRrGRVSQ/62pJrDO0EGY.jpg?size=896x568&quality=95&sign=ec542fd10973965d06fc92ac3d5879e4&type=album,For Putin / Dickhead!,"Putin (general), Russia (general), Z and/or V",Russia,Russian,News photo,Putin,62pJrDO0EGY,https://drive.google.com/open?id=19mCQ4wc9G93tqicF02CjiIk7Zo1UMnjG
2022-07-24T10:48:44.000Z,7/24/2022,Z - Zадержки в развитии,https://sun6-20.userapi.com/impf/AOtTBujR_ARHpCIuZ1MutNQKGUAhFyrRyNrLlA/g004QXvnkyQ.jpg?size=1000x510&quality=95&sign=21031fcac1a4e64fdb6ef531d9872339&type=album,Z - Developmental delay,Z and/or V,Russia,Russian,Text only,,g004QXvnkyQ,https://drive.google.com/open?id=1No6YlGT-fFa23Mb_5Rg8cYk_Xu5sPNkp
2022-07-24T12:17:23.000Z,7/24/2022,"У лебедей затянувшийся перекур... Но ""Лебединое озеро"" мы все-таки дождемся...",https://t.me/slvn_pomet/2374?comment=1753290,"The swans have been on a long smoke break ... But we will see the ""Swan Lake"" ... [A ballet traditionally broadcast on Soviet state TV after the announcements of passing of heads of state].","Dance of the Little Swans, End of the Putin regime",Russia,Russian,Historical photo,,photo_2022-07-24_15-12-13,https://drive.google.com/open?id=1X1IaNLFt6MAXuWJF1Q0lGv9N7bs338iQ
2022-07-24T12:21:18.000Z,7/24/2022,"""Властелин овец"" [...]",https://t.me/slvn_pomet/2374?comment=1753200,Lord of the sheep [...],"Putin (general), Russian propaganda and state media, Obedient Russians",Russia,Russian,News photo,Putin,photo_2022-07-24_15-18-54,https://drive.google.com/open?id=1axGE6tiTFzHTH3JK-or3Es-AnCyZRQjC
2022-07-24T12:55:19.000Z,7/24/2022,Himars o'clock,https://t.me/sternenkochat/1575411,,Lend-Lease and other military assistance to Ukraine,Ukraine,English,Animal photo,,photo_2022-07-24_15-53-55,https://drive.google.com/open?id=1Q8jaH11dfS4iBsD2bKk0VVUf_Og4dE-0
2022-07-24T12:58:44.000Z,7/24/2022,Час *банути по кацапским складам боєприпасів,https://t.me/ssternenko/6883?comment=1575424,It's time to f*ck up the Katsaps' ammunition depots,"Ukrainian troops (general), War progress / outcome (general)","Ukraine, Russia",Ukrainian,Animal photo,,photo_2022-07-14_03-23-29,https://drive.google.com/open?id=1Q8WDkQ9EKWyQodz_pkuzcnGnTjGYAEvM
2022-07-24T13:00:59.000Z,7/24/2022,"- Is it HIMARS o'clock? - Yes. - Yes, but in Yellow.",https://t.me/ssternenko/6883?comment=1575430,,Lend-Lease and other military assistance to Ukraine,Ukraine,English,Infographics,,photo_2022-07-24_15-58-56,https://drive.google.com/open?id=1exeKPp0mxJg8qXQ0rO1-7PShw62nMni3
2022-07-24T13:04:10.000Z,7/24/2022,"""Нiчь яка мiсячна, зоряная, ясная! Видно, хочь оркiв стрiляй.""",https://t.me/ssternenko/6883?comment=1575434,"""What a moonlit, starry, clear night! You can see everything, you could even shoot the orcs.""","Russian troops (general), Ukrainian troops (general)",Ukraine,Ukrainian,Stock photo,,photo_2022-07-24_16-01-06,https://drive.google.com/open?id=1HifwsadaTHPYMnmwKt7y_p8qEwoZFf21
2022-07-24T13:07:00.000Z,7/24/2022,HiMars : усе буде в шоколадi,https://t.me/ssternenko/6883?comment=1575457,HIMARS: everything will be perfect,Lend-Lease and other military assistance to Ukraine,Ukraine,Ukrainian,Branding,,photo_2022-07-24_16-04-51,https://drive.google.com/open?id=10iHc-k0aeRkcO3pwk5sRhL4QAQmuMaSA
2022-07-24T13:20:49.000Z,7/24/2022,Хто як не ти спалить мости,https://t.me/ssternenko/6883?comment=1575533,Who but you will burn bridges,Lend-Lease and other military assistance to Ukraine,"Ukraine, Russia",Ukrainian,News photo,,photo_2022-07-24_16-18-53,https://drive.google.com/open?id=1ieM-5N0rRVwbB6nMqxyfo-j4yWTavyQo
2022-07-24T13:23:49.000Z,7/24/2022,Каждый вечер вечер наступает вдруг...,https://t.me/ssternenko/6883?comment=1575550,"Every evening, evening comes suddenly ...","Ukrainian troops (general), War progress / outcome (general)",Ukraine,Russian,News photo,Zelensky,photo_2022-07-24_16-21-58,https://drive.google.com/open?id=1CCpUx-x_RFnl4MHP9H_-93DwfxdNBhKU
2022-07-24T13:26:02.000Z,7/24/2022,"HIMARS o'clock -- Wait, it's HIMARS time? -- Always has been",https://t.me/ssternenko/6883?comment=1575552,,"Lend-Lease and other military assistance to Ukraine, Ukrainian troops (general)",Ukraine,English,Always has been,,photo_2022-07-24_16-24-06,https://drive.google.com/open?id=1DcI1Gngb7eGpntGKtxSRqmKkFE3B7Gsr
2022-07-24T13:29:49.000Z,7/24/2022,"- Добрий вечiр, а Хаймарс вийде? - Зараз повечеряє i вийде!",https://t.me/ssternenko/6883?comment=1575622,"- Good evening, will HIMARS come out? - He will finish his dinner and then he'll come out!","Lend-Lease and other military assistance to Ukraine, Ukrainian troops (general)",Ukraine,Ukrainian,Text only,,photo_2022-07-24_16-26-24,https://drive.google.com/open?id=1-NvABgCIHZiLKe65nbzzd6uqJMF2tJln
2022-07-24T13:33:54.000Z,7/24/2022,"Літай, наче метелик. Жаль, що твоя частина згоріла.",https://t.me/ssternenko/6883?comment=1575709,Fly like a butterfly. Too bad your unit got burned.,"Lend-Lease and other military assistance to Ukraine, Ukrainian troops (general)",Ukraine,Ukrainian,War photo,,photo_2022-07-24_16-31-14,https://drive.google.com/open?id=1WrXADIaXiAdKgAXdSGnj9fLAUsr_Lg-N
2022-07-24T13:36:02.000Z,7/24/2022,[HIMARS threatens a Russian soldier],https://t.me/ssternenko/6883?comment=1575728,,"Lend-Lease and other military assistance to Ukraine, Russian troops (general)",Ukraine,n/a,Film (non-Soviet),,photo_2022-07-24_16-34-10,https://drive.google.com/open?id=13ZzwFXcCuyg7p8Tu7hYc5fakHofS3VDV
2022-07-24T15:50:13.000Z,7/23/2022,How to tell if Russia is lying? Russia Speaks -> Yes -> Russia is lying,https://www.instagram.com/p/CgW0rAEM9_9/?igshid=YmMyMTA2M2Y%3D,,Russia (general),Russia,English,Text only,,Russia lying,https://drive.google.com/open?id=1ZMkTU5rPn8pb-VfWfsj_-ZVrXFgTIJip
2022-07-24T15:53:27.000Z,7/1/2022,Z,https://www.instagram.com/p/CfdqtPUtxMZ/?igshid=YmMyMTA2M2Y%3D,,Z and/or V,Russia,n/a,Artwork,,Z,https://drive.google.com/open?id=1LWjxgd_gTmY0oh9XQAbJ_dnlDfhn7SxE
2022-07-24T15:55:47.000Z,7/1/2022,Fuck u Putin,https://www.instagram.com/p/CfgAVLct1ht/?igshid=YmMyMTA2M2Y%3D,,"Ukraine (general), Putin (general)","Ukraine, Russia",English,Stock photo,Putin,f u putin,https://drive.google.com/open?id=1RJopBpNpaafBSWGQZj2HRRuPowgN_aBD
2022-07-24T16:03:58.000Z,7/19/2022,"Wanted dead or alive -- Cash reward $10,000 -- Approach with caution -- Dangerous & always heavily armed (МВД росии обьявило @gordondmytro в розыск)",https://www.instagram.com/p/CgM_KFAtiyD/?igshid=YmMyMTA2M2Y%3D,The Russian Ministry of Internal Affairs put @gordondmytro on the most wanted list,Ukraine (general),"Ukraine, Russia","Russian, English",Poster,Gordon (Dmytro ),Gordon Wanted,https://drive.google.com/open?id=1rrMcSKGwJVUx2uzHeKZWySoNNoTvTCiv
2022-07-24T16:13:34.000Z,6/5/2022,День Победы,https://www.instagram.com/p/CebxzynoQKw/?igshid=YmMyMTA2M2Y%3D,Victory Day,Victory Day (1945),Russia,Russian,Lord of the Rings (film),,Victory Day Orc,https://drive.google.com/open?id=1MOQSFOl9yPErvgdZ5v8VYhRf3k8wa3Tn
2022-07-24T17:28:32.000Z,7/11/2022,"Шопінг. До війни: нова колекцiя - хочу, але обійдусь без неї. Зараз: за українську економіку.",https://www.instagram.com/p/Cf30JLBrwrG/?igshid=YmMyMTA2M2Y%3D,"Shopping. Before the war: a new collection - I want it, but I can do without it. Now: for the Ukrainian economy.",Economic impact of the war,Ukraine,Ukrainian,Cartoon,,Shopping,https://drive.google.com/open?id=1MqIrO9sKJVosCvQwearKXugCAow3b1-u
2022-07-24T17:41:44.000Z,3/9/2022,"Zа победу! Нас не сломают никакие санкции. Мы дома, на своей земле. Дубаи.",https://www.instagram.com/p/Ca5HshEAXUj/?igshid=YmMyMTA2M2Y%3D,"For the victory! No sanctions will break us. We are at home, on our land. Dubai",,"Russia, UAE",Russian,Cartoon,Baskov,Baskov Dubai,https://drive.google.com/open?id=1qi_3xYiVuWGZuqjx7Ultp1jTngPG74RZ
2022-07-24T17:46:04.000Z,7/21/2022,Земля -- Галактика -- Сонце -- Мій біль після перегляду новин,https://www.instagram.com/p/CgTzmlOLIOt/,The Earth -- The Galaxy -- The Sun -- My pain after watching the news,War news - dealing with them,Ukraine,Ukrainian,Cartoon,,Galaxy News Pain,https://drive.google.com/open?id=1lwidpQfYSwzurfKTvDA_Yf6O-Hmu0jb0
2022-07-24T17:51:02.000Z,7/8/2022,[Boris Johnson upset with Macron hugging Zelensky],https://www.instagram.com/p/CfwDpbyuib2/?igshid=YmMyMTA2M2Y%3D,,"Humanitarian aid to Ukraine, Lend-Lease and other military assistance to Ukraine","Ukraine, France, Great Britain",n/a,Macron hugging Zelensky,"Zelensky, Johnson (Boris), Macron",Macron Johnson Upset,https://drive.google.com/open?id=1CPmOJMU_yP8DtF3TLuo_YIEg8TMZFtu1
2022-07-24T17:54:10.000Z,7/12/2022,"Missing: Please help us find Olaf Scholz's balls. Last seen in the Kremlin, мissing since 24 Feb 2022 / If you know where Scholz's balls are, please retrieve them for the sake of Europe and Democracy",https://www.instagram.com/p/Cf6EDl7tar3/?igshid=YmMyMTA2M2Y%3D,,Concessions to Putin / wavering support for Ukraine,"Ukraine, Russia, Germany",English,Poster,Scholz (Olaf),Missing Scholz,https://drive.google.com/open?id=1QxIqTtG-ATtpSAiBh-y4VcpggkkaMlQm
2022-07-24T18:11:37.000Z,7/24/2022,Приехал из России воевать в Донецк: ожидание -- реальность,https://t.me/RealnaiaBelarus/36417?comment=815034,Came from Russia to fight in Donetsk: expectation -- reality,"Russian troops (general), War progress / outcome (general)","Ukraine, Russia",Russian,News photo,,photo_2022-07-24_21-08-40,https://drive.google.com/open?id=1aguPeri7_rgSJyJdClcs8Z_S7sfRgnPq
2022-07-24T18:14:32.000Z,7/24/2022,"Вставай, собирайся, мы всерьез еще не начинали.",https://t.me/RealnaiaBelarus/36417?comment=815035,"Get up, get ready, we haven't really started yet.","Russian propaganda and state media, Russian troops (general), We haven't really started anything yet","Ukraine, Russia",Russian,War photo,Putin,photo_2022-07-24_21-12-00,https://drive.google.com/open?id=1MuDE89Dz-F8YIUs5tu78qgikOhnAU9Cw
2022-07-24T18:32:45.000Z,3/30/2022,Hello Will Smith! Did you hear what Vladimir Putin said about your wife?,https://www.instagram.com/p/CbvJTP7L_rm/?igshid=YmMyMTA2M2Y%3D,,Lend-Lease and other military assistance to Ukraine,"Ukraine, Russia, United States",English,News photo,"Putin, Zelensky, Smith (Will)",Will Smith Zelensky,https://drive.google.com/open?id=13n3wtgDwTUVKV3wjgGYmLNpz0qCifLZ3
2022-07-24T18:34:19.000Z,3/29/2022,Zelensky slaps Putin,https://www.instagram.com/p/CbsRhn3rQx8/?igshid=YmMyMTA2M2Y%3D,,"Putin (general), Zelensky (general)","Ukraine, Russia",n/a,Will Smith Slapping Chris Rock,"Putin, Zelensky, Smith (Will)",Zelensky slaps Putin,https://drive.google.com/open?id=1uURBhTctmUooM7Qrgxzz5Leu3XtmK0V2
2022-07-24T18:37:10.000Z,3/6/2022,Thank goodness all of my friends stopped being infectious disease experts and became expert war correspondents instead,https://www.instagram.com/p/CaxECfYLN5n/?igshid=YmMyMTA2M2Y%3D,,War news - dealing with them,United States,English,Film (non-Soviet),,Experts,https://drive.google.com/open?id=1xT8na33HwzozIRgLmqQBYbr6QXJuUN7X
2022-07-24T18:39:27.000Z,7/8/2022,[2000-2022 UK prime minister turnovers versus Putin],https://www.instagram.com/p/Cfwnqc9M84J/?igshid=YmMyMTA2M2Y%3D,,Putin (general),"Russia, Great Britain",n/a,Infographics,Putin,UK v Putin,https://drive.google.com/open?id=176yqqrQcqpxDkQLLdMFuWUeeaSsc1usS
2022-07-24T18:45:06.000Z,3/21/2022,Це я стою у шмотках з місцевого ринку та чекаю коли Арестович скаже їхати додому,https://www.instagram.com/p/CbXSju2N6xg/?igshid=YmMyMTA2M2Y%3D,Me standing in clothes from the local market waiting for Arestovich to tell me to go home,Civilian resistance in Ukraine,Ukraine,Ukrainian,Performer photo,"Serdiuchka, Arestovich",Verka,https://drive.google.com/open?id=1L_nggTOuBikhVJTCh8cXZjbxFrhjTPiU
2022-07-24T19:00:33.000Z,3/21/2022,Хтось сказав рельсова війна? Я готова!,https://www.instagram.com/p/CbYChurNpn3/?igshid=YmMyMTA2M2Y%3D,Who said it railway war? I'm ready!,Civilian resistance in Ukraine,Ukraine,Ukrainian,Performer photo,Serdiuchka,Verka Railway,https://drive.google.com/open?id=12aN3n0ptOTSQMjP6RQfDADb97KoKC7Vz
2022-07-24T19:08:45.000Z,4/14/2022,Contex classic -- Пропагандон классический,https://www.instagram.com/p/CcVm2bntvgI/?igshid=YmMyMTA2M2Y%3D,Contex classic -- Propacondom classic,Russian propaganda and state media,Russia,"Russian, English",Branding,Solov'ev (Vladimir),Solovyov Contex,https://drive.google.com/open?id=1vI_biL7LZMQw4gKenye4C-MguD-50nB9
2022-07-24T19:30:39.000Z,3/27/2022,"Звичайна українська родина за версією російських ЗМІ: агент НАТО, Степан Бандера, неонацист, координатор реактивних голубів",https://www.instagram.com/p/CbnKPnItOlU/?igshid=YmMyMTA2M2Y%3D,"An ordinary Ukrainian family according to the Russian media: NATO agent, Stepan Bandera, neo-Nazi, jet pigeon coordinator","Ukraine (general), Russian propaganda and state media","Ukraine, Russia",Ukrainian,Cartoon,,Real Ukrainian Family,https://drive.google.com/open?id=1a4wiu0YG5kQGYlKYYJdD2z715wIO6_A9
2022-07-24T19:33:36.000Z,4/13/2022,"Ukraine and Russia have never been ""brotherly nations"" [...]",https://www.instagram.com/p/CcTLeG2t12O/?igshid=YmMyMTA2M2Y%3D,,"Russian propaganda and state media, Russia (general), Ukraine (general)","Ukraine, Russia",English,TV show,,Jim Russian Propaganda,https://drive.google.com/open?id=1Ru1lR5enMKH1P5b8VzizOo0Icq7KWMYH
2022-07-24T19:36:39.000Z,4/18/2022,"It's not just Putin's war. It's not Putin who is raping, looting and killing civilians in Ukraine. It's not Putin who encourages Russian soldiers to do it. Skeletor will return next week with more disturbing facts.",https://www.instagram.com/p/CcfBx_wNBw9/?igshid=YmMyMTA2M2Y%3D,,"Russia (general), Russian troops (general)","Ukraine, Russia",English,TV show,Putin,Skeletor Russian troops,https://drive.google.com/open?id=1_zN2XHboELe7P6hK7hWXged9bpkya7wI
2022-07-24T19:45:37.000Z,6/16/2022,"Те, що я говорив з ним нічого не значить, я завжди любив тілки тебе...",https://www.instagram.com/p/Ce4OU-nrCPc/,What I said to him didn't mean anything. I always loved you and only you,Concessions to Putin / wavering support for Ukraine,"Ukraine, Russia, France",Ukrainian,Macron hugging Zelensky,"Zelensky, Macron",Macron hug,https://drive.google.com/open?id=1QpLDQTqCOAPv36FhtempH_lvr2jrSf7P
2022-07-24T19:49:18.000Z,3/5/2022,Types of headaches: migraine -- hypertension -- stress -- living next to Russia,https://www.instagram.com/p/Cau0Al_r8Ri/?igshid=YmMyMTA2M2Y%3D,,"Russia (general), Ukraine (general)","Ukraine, Russia",English,Infographics,,Headache,https://drive.google.com/open?id=1Pp_p27V0Owsi04ZU9eyz6w3x2L2TkM60
